affil_name,status,valid_ids,affil_names_valid,invalid_ids,affil_names_invalid,eid,author,affil_city
"Mary Kay O'Connor Process Safety Center, Texas A&M Engineering Experiment Station",Not in HAL,,,,,2-s2.0-85178664213,Abdullah Alsulieman,College Station
"Artie McFerrin Department of Chemical Engineering, Texas A&M University",In HAL (Valid),301080,Texas A&M University [College Station],,,2-s2.0-85178664213,Abdullah Alsulieman,College Station
"Industrial and Systems Engineering Department, Texas A&M University",In HAL (Valid),301080,Texas A&M University [College Station],,,2-s2.0-85178664213,Faisal Khan,College Station
"Gas and Fuels Research Center, Texas A&M Engineering Experiment Station",Not in HAL,,,,,2-s2.0-85178664213,Mahmoud El-Halwagi,College Station
"Chair on Risk and Resilience of Complex Systems, Laboratoire Genie Industriel, Universite Paris-Saclay",In HAL (Valid),"419361, 1043712, 411575",Université Paris-Saclay | CentraleSupélec | Laboratoire Génie Industriel [LGI],,,2-s2.0-85178664213,Xihe Ge,
"Chair on Risk and Resilience of Complex Systems, Laboratoie Genie Industriel, CentraleSupélec, Université Paris-Saclay",In HAL (Valid),"419361, 411575",Université Paris-Saclay | CentraleSupélec,,,2-s2.0-85165538390,Anne Barros,Gif-sur-Yvette
"Department of Industrial Systems Engineering, Rutgers University",In HAL (Valid),566577,Rutgers University System [Rutgers],,,2-s2.0-85165538390,David Coit,Piscataway
"Networks/CASE/A4N, Orange Innovation",In HAL (Valid),1079675,Orange Innovation,,,2-s2.0-85159721070,Rui Li,Châtillon
"CentraleSupélec, Laboratoire Génie Industriel",In HAL (Valid),"419361, 1043712, 411575",Université Paris-Saclay | CentraleSupélec | Laboratoire Génie Industriel [LGI],,,2-s2.0-85159721070,Rui Li,Gif-sur-Yvette
Thales Research & Technology,In HAL (Valid),"19045, 250969",THALES [France] | Thales Research and Technology [Palaiseau],,,2-s2.0-85159205217,Andrea Bellè,Palaiseau
"Chair on Risk and Resilience of Complex Systems, Laboratoire Génie Industriel, CentraleSupélec, Université Paris-Saclay",In HAL (Valid),"419361, 1043712, 411575",Université Paris-Saclay | CentraleSupélec | Laboratoire Génie Industriel [LGI],,,2-s2.0-85159205217,Andrea Bellè,Gif-sur-Yvette
"Laboratoire Génie Industriel, CentraleSupélec, université Paris-Saclay",In HAL (Valid),"419361, 1043712, 411575",Université Paris-Saclay | CentraleSupélec | Laboratoire Génie Industriel [LGI],,,2-s2.0-85159205217,Adam F. Abdin,Gif-sur-Yvette
"Faculty of Science, Utrecht University",In HAL (Valid),300572,Universiteit Utrecht / Utrecht University [Utrecht],,,2-s2.0-85149406585,Mihaela Mitici,CS Utrecht
"Faculty of Aerospace Engineering, Delft University of Technology",In HAL (Valid),"62731, 333368",Faculty of Aerospace Engineering [Delft] | Delft University of Technology [TU Delft],,,2-s2.0-85149406585,Ingeborg de Pater,Delft
"Laboratoire Genie Industriel, CentraleSupélec, Université Paris-Saclay",In HAL (Valid),"419361, 1043712, 411575",Université Paris-Saclay | CentraleSupélec | Laboratoire Génie Industriel [LGI],,,2-s2.0-85149406585,Anne Barros,Gif-sur-Yvette
"University of Electronic Science and Technology of China, School of Mechanical and Electrical Engineering",In HAL (Valid),373746,University of Electronic Science and Technology of China [Chengdu] [UESTC],,,2-s2.0-85135760993,Tangfan Xiahou,Chengdu
"University of Electronic Science and Technology of China, Center for System Reliability and Safety",In HAL (Valid),373746,University of Electronic Science and Technology of China [Chengdu] [UESTC],,,2-s2.0-85135760993,Yu Liu,Chengdu
"Industrial Engineering Laboratory (LGI) CentraleSupèlec, Paris-Saclay University",In HAL (Valid),419361,Université Paris-Saclay,,,2-s2.0-85172788020,Abdelhamid Boujarif,Gif-sur-Yvette
"Department of Industrial and Systems Engineering, Rutgers University",In HAL (Valid),566577,Rutgers University System [Rutgers],,,2-s2.0-85172788020,David W. Coit,
General Electric Healthcare,In HAL (Valid),7191,General Electric Medical Systems [Buc] [GE Healthcare],,,2-s2.0-85172788020,Robert Heidsieck,
"University Paris Saclay, CentraleSupélec",In HAL (Valid),"419361, 411575",Université Paris-Saclay | CentraleSupélec,,,2-s2.0-85151498277,Youba Nait Belaid,Paris
Electricité de France (EDF) R&d,In HAL (Valid),"302313, 528389",EDF [EDF] | EDF R&D [EDF R&D],,,2-s2.0-85151498277,Youba Nait Belaid,Paris
"School of Mechanical and Electrical Engineering, University of Electronic Science and Technology of China",In HAL (Valid),373746,University of Electronic Science and Technology of China [Chengdu] [UESTC],,,2-s2.0-85141134865,Tangfan Xiahou,Chengdu
"Center for System Reliability and Safety, University of Electronic Science and Technology of China",In HAL (Valid),373746,University of Electronic Science and Technology of China [Chengdu] [UESTC],,,2-s2.0-85141134865,Tangfan Xiahou,Chengdu
"University of Electronic Science and Technology of China, School of Mechanical and Electrical Engineering, Center for System Reliability and Safety",In HAL (Valid),373746,University of Electronic Science and Technology of China [Chengdu] [UESTC],,,2-s2.0-85144185585,Yu Liu,Chengdu
"School of Aeronautics and Astronautics, Sichuan University",In HAL (Valid),440644,Sichuan University [Chengdu] [SCU],,,2-s2.0-85137640598,Jianyu Wang,Chengdu
"Laboratoire Genie Industriel, CentraleSupélec, Université Paris Saclay",In HAL (Valid),"419361, 1043712, 411575",Université Paris-Saclay | CentraleSupélec | Laboratoire Génie Industriel [LGI],,,2-s2.0-85137640598,Jianyu Wang,Gif-sur-Yvette
"College of Electrical Engineering, Sichuan University",In HAL (Valid),440644,Sichuan University [Chengdu] [SCU],,,2-s2.0-85137640598,Heng Zhang,Chengdu
"Risk and Resilience of Complex Systems, Laboratoire Génie Industriel, CentraleSupélec, Université Paris-Saclay",In HAL (Valid),"419361, 1043712, 411575",Université Paris-Saclay | CentraleSupélec | Laboratoire Génie Industriel [LGI],,,2-s2.0-85142261493,Andrea Bellè,
Electricité de France RandD,In HAL (Valid),"302313, 528389",EDF [EDF] | EDF R&D [EDF R&D],,,2-s2.0-85142234353,Youba Nait Belaid,Palaiseau
"Risk and Resilience of Complex Systems, Laboratoire Génie Industriel, CentraleSupélec, Université Paris-Saclay",In HAL (Valid),"419361, 1043712, 411575",Université Paris-Saclay | CentraleSupélec | Laboratoire Génie Industriel [LGI],,,2-s2.0-85142234353,Anne Barros,Gif-sur-Yvette
"College of Electrical Engineering, Zhejiang University",In HAL (Valid),"493651, 8138",College of Electrical Engineering [Zhejiang] | Zhejiang University,,,2-s2.0-85103246865,Yi Ding,Hangzhou
"Sichuan University, College of Electrical Engineering",In HAL (Valid),440644,Sichuan University [Chengdu] [SCU],,,2-s2.0-85139388609,Jianyu Wang,Chengdu
"CentraleSupélec, Université Paris Saclay, Laboratoire Genie Industriel",In HAL (Valid),"419361, 1043712, 411575",Université Paris-Saclay | CentraleSupélec | Laboratoire Génie Industriel [LGI],,,2-s2.0-85139388609,Jianyu Wang,Gif-sur-Yvette
Orange Innovation,In HAL (Valid),1079675,Orange Innovation,,,2-s2.0-85129636032,Rui Li,Chatillon
"Universite Paris-Saclay, Laboratoire Genie Industriel CentraleSupelec",In HAL (Valid),419361,Université Paris-Saclay,,,2-s2.0-85129636032,Rui Li,Gif-sur-Yvette
"Chair on Risk and Resilience of Complex Systems, Laboratoire Génie Industriel, CentraleSupélec, Université Paris-Saclay",In HAL (Valid),"419361, 1043712, 411575",Université Paris-Saclay | CentraleSupélec | Laboratoire Génie Industriel [LGI],,,2-s2.0-85116573986,Anne Barros,
Électricité de France (EDF) R&D Palaiseau,Not in HAL,,,,,2-s2.0-85116573986,Carole Duval,
"SNCF, Direction Technologies Innovation et Projet Groupe, Innovation & Recherche, Département Physique du Système Ferroviaire, Equipe Sécurité Système",In HAL (Valid),"198197, 300503",SNCF | SNCF : Innovation & Recherche,,,2-s2.0-85116573986,Marc Sango,
"Laboratoire Genie Industriel, Chair on Risk and Resilience of Complex Systems, Université Paris Saclay, CentraleSupélec",In HAL (Valid),"419361, 1043712, 411575",Université Paris-Saclay | CentraleSupélec | Laboratoire Génie Industriel [LGI],,,2-s2.0-85095418876,Tasneem Bani-Mustafa,Gif-sur-Yvette
"Department of Industrial Economics, Risk Management and Planning, University of Stavanger",In HAL (Valid),"301146, 495159",Department of Industrial Economics and Technology Management [Stavanger] | University of Stavanger,,,2-s2.0-85095418876,Roger Flage,Stavanger
"MINESParisTech, PSL Research University, CRC",In HAL (Valid),"54155, 301492",Centre de recherche sur les Risques et les Crises [CRC] | Mines Paris - PSL (École nationale supérieure des mines de Paris),,,2-s2.0-85095418876,Enrico Zio,Sophia Antipolis
"Energy Department, Politecnico di Milano",In HAL (Valid),125443,Politecnico di Milano [Milan] [POLIMI],,,2-s2.0-85095418876,Enrico Zio,Milan
Electricité de France R&D,In HAL (Valid),"302313, 528389",EDF [EDF] | EDF R&D [EDF R&D],,,2-s2.0-85106872144,Youba Nait Belaid,Palaiseau
"School of Management, Shanghai University",In HAL (Valid),323305,Shanghai University,,,2-s2.0-85100170341,Qingqing Zhai,Shanghai
"School of Reliability and Systems Engineering, Beihang University",In HAL (Valid),"411674, 529602",Beihang University [BUAA] | School of Reliability and Systems Engineering [Beijing],,,2-s2.0-85100170341,Shijia Du,Beijing
"College of Energy and Electrical Engineering, Hohai University",In HAL (Valid),316556,Hohai University,,,2-s2.0-85094325012,Xingying Chen,Nanjing
"School of Reliability and Systems Engineering, Beihang University",In HAL (Valid),"411674, 529602",Beihang University [BUAA] | School of Reliability and Systems Engineering [Beijing],,,2-s2.0-85135497898,Jie Liu,
"Laboratoire Génie Industriel, CentraleSupélec, Université Paris-Saclay",In HAL (Valid),"419361, 1043712, 411575",Université Paris-Saclay | CentraleSupélec | Laboratoire Génie Industriel [LGI],,,2-s2.0-85135437717,Andrea Bellè,
"Dept. of Infrastructure Innovation and Engineering, Orange Labs Networks",In HAL (Valid),573593,Orange Labs Networks,,,2-s2.0-85129653267,Khaled Sayad,Lannion
"Chaire Risk and Resilience of Complex Systems, Laboratoire Génie Industriel, CentraleSupélec, Université Paris-Saclay",In HAL (Valid),"419361, 1043712, 411575",Université Paris-Saclay | CentraleSupélec | Laboratoire Génie Industriel [LGI],,,2-s2.0-85129653267,Khaled Sayad,Gif-sur-Yvette
Orange Innovation,In HAL (Valid),1079675,Orange Innovation,,,2-s2.0-85129600098,Bertrand Decocq,Châtillon
"Chair Risk and Resilience of Complex Systems, Laboratoire Génie Industriel (LGI), CentraleSupélec, Université Paris Saclay",In HAL (Valid),"419361, 1043712, 411575",Université Paris-Saclay | CentraleSupélec | Laboratoire Génie Industriel [LGI],,,2-s2.0-85086595566,Jinduo Xing,Gif-sur-Yvette
"MINES ParisTech, PSL Research University, CRC",In HAL (Valid),"54155, 301492",Centre de recherche sur les Risques et les Crises [CRC] | Mines Paris - PSL (École nationale supérieure des mines de Paris),,,2-s2.0-85086595566,Enrico Zio,Sophia Antipolis
"Eminent Scholar, Department of Nuclear Engineering, College of Engineering, Kyung Hee University",In HAL (Valid),305304,Kyung Hee University [KHU],,,2-s2.0-85086595566,Enrico Zio,
"Chair on Risk and Resilience of Complex Systems, Laboratoire Genie Industriel, CentraleSupélec, Université Paris-Saclay",In HAL (Valid),"419361, 1043712, 411575",Université Paris-Saclay | CentraleSupélec | Laboratoire Génie Industriel [LGI],,,2-s2.0-85083873403,Tasneem Bani-Mustafa,
University of Stavanger,In HAL (Valid),301146,University of Stavanger,,,2-s2.0-85083873403,Roger Flage,
"EDF R&D, PERICLES",In HAL (Valid),"528447, 528389",EDF R&D [EDF R&D] | PERformance et prévention des Risques Industriels du parC par la simuLation et les EtudeS [EDF R&D PERICLES],,,2-s2.0-85083873403,Dominique Vasseur,
"Chair on System Science and the Energetic Challenge, EDF Foundation, Laboratoire Genie Industriel, CentraleSupélec, Université Paris-Saclay",In HAL (Valid),"419361, 1043712, 411575",Université Paris-Saclay | CentraleSupélec | Laboratoire Génie Industriel [LGI],,,2-s2.0-85077745269,Tasneem Bani-Mustafa,Gif-sur-Yvette
"EDF R&D, PERICLES (Performance et prévention des Risques Industriels du parc par la simulation et Les Etudes) EDF Lab Paris Saclay",In HAL (Valid),"302313, 528389",EDF [EDF] | EDF R&D [EDF R&D],,,2-s2.0-85077745269,Dominique Vasseur,Palaiseau
"Crisis and Risk Research Centre, Ecole des Mines de Paris, MINES ParisTech",In HAL (Valid),"301492, 564132",Mines Paris - PSL (École nationale supérieure des mines de Paris) | Université Paris sciences et lettres [PSL],,,2-s2.0-85089179250,Enrico Zio,
"Dipartimento di Energia, Politecnico di Milano",In HAL (Valid),"450347, 125443",Politecnico di Milano [Milan] [POLIMI] | Dipartimento di Energia [Milano],,,2-s2.0-85089179250,Enrico Zio,
"System Science and the Energetic Challenge, EDF Foundation, Laboratoire Genie Industriel, CentraleSupélec, Université Paris-Saclay",In HAL (Valid),"419361, 1043712, 411575",Université Paris-Saclay | CentraleSupélec | Laboratoire Génie Industriel [LGI],,,2-s2.0-85072530616,Tasneem Bani-Mustafa,Gif-sur-Yvette
"Chair System Science and the Energy Challenge, Fondation Electricité de France (EDF), CentraleSupélec, Université Paris Saclay",In HAL (Valid),"419361, 411575",Université Paris-Saclay | CentraleSupélec,,,2-s2.0-85072563734,Jinduo Xing,Gif-sur-Yvette
"Department of Nuclear Engineering, College of Engineering, Kyung Hee University",In HAL (Valid),305304,Kyung Hee University [KHU],,,2-s2.0-85072563734,Enrico Zio,
"Chair System Science and the Energy Challenge, Fondation Electricité de France (EDF), CentraleSupélec, Université Paris Saclay",In HAL (Valid),"419361, 411575",Université Paris-Saclay | CentraleSupélec,,,2-s2.0-85070696503,Enrico Zio,
"Politecnico di Milano, Energy Department",In HAL (Valid),125443,Politecnico di Milano [Milan] [POLIMI],,,2-s2.0-85065030373,Enrico Zio,Milano
"Department on System Science and the Energy Challenge, Fondation Electricite de France, Laboratoire Genie Industriel, CentraleSupelec, Universite Paris-Saclay",In HAL (Valid),"419361, 1043712, 411575",Université Paris-Saclay | CentraleSupélec | Laboratoire Génie Industriel [LGI],,,2-s2.0-85056303883,Enrico Zio,Gif-sur-Yvette
"Sino-French Risk Science and Engineering Lab, Beihang University",In HAL (Valid),411674,Beihang University [BUAA],,,2-s2.0-85050465530,Enrico ZIO,Beijing
"System Science and the Energy Challenge, Fondation Electricite de France, CentraleSupélec, Université Paris-Saclay",In HAL (Valid),"419361, 411575",Université Paris-Saclay | CentraleSupélec,,,2-s2.0-85040599059,Enrico Zio,Chatenay-Malabry
"Chair System Science and the Energy Challenge, Fondation Electricité de France (EDF), CentraleSupélec, Université Paris-Saclay",In HAL (Valid),"419361, 411575",Université Paris-Saclay | CentraleSupélec,,,2-s2.0-85032888897,Enrico Zio,
Energy Department,Not in HAL,,,,,2-s2.0-85032888897,Enrico Zio,
"School of Reliability and Systems Engineering, Beihang University",In HAL (Valid),"411674, 529602",Beihang University [BUAA] | School of Reliability and Systems Engineering [Beijing],,,2-s2.0-85032888897,Rui Kang,
"School of Mechanical Engineering and Automation, Beihang University",In HAL (Valid),411674,Beihang University [BUAA],,,2-s2.0-85059693463,Juan Chen,Beijing
"Department on Systems Science and the Energy Challenge, Fondation Electricité de France, Laboratoire Genie Industriel, CentraleSupélec, Université Paris Saclay",In HAL (Valid),"419361, 1043712, 411575",Université Paris-Saclay | CentraleSupélec | Laboratoire Génie Industriel [LGI],,,2-s2.0-85059693463,Juan Chen,Gif-sur-Yvette
"Siemens PLM Software, SIEMENS Company",Not in HAL,,,,,2-s2.0-85059693463,Jia Li,Beijing
"School of Mechanical Electronic and Information Engineering, China University of Mining and Technology",In HAL (Valid),356390,China University of Mining and Technology [CUMT],,,2-s2.0-85059693463,Chong Bu,Beijing
"EDF Foundation, Laboratoire Genie Industriel, CentraleSupélec, Université Paris-Saclay",In HAL (Valid),"419361, 1043712, 411575",Université Paris-Saclay | CentraleSupélec | Laboratoire Génie Industriel [LGI],,,2-s2.0-85058108917,Tasneem Bani-Mustafa,
"EDF R&D, PERICLES (Performance et Prévention des Risques Industriels du Parc par la Simulation et les Etudes), EDF Lab Paris Saclay",In HAL (Valid),"528447, 528389",EDF R&D [EDF R&D] | PERformance et prévention des Risques Industriels du parC par la simuLation et les EtudeS [EDF R&D PERICLES],,,2-s2.0-85058108917,Dominique Vasseur,
"Chair on System Science and the Energy Challenge, Fondation Electricite de France (EDF), CentraleSupélec, Université Paris-Saclay",In HAL (Valid),"419361, 411575",Université Paris-Saclay | CentraleSupélec,,,2-s2.0-85017562754,Enrico Zio,Chatenay-Malabry
"EDF Foundation Chair on Systems Science and Energetic Challenge, CentraleSupelec, Universite Paris-Saclay",In HAL (Valid),"419361, 411575",Université Paris-Saclay | CentraleSupélec,,,2-s2.0-85028347754,Zhiguo ZENG,Chatenay-Malabry
"Energy Department, Politecnico di Milano",In HAL (Valid),125443,Politecnico di Milano [Milan] [POLIMI],,,2-s2.0-85028347754,Enrico ZIO,
"Center for Resilience and Safety of Critical Infrastructure, Beihang University",In HAL (Valid),411674,Beihang University [BUAA],,,2-s2.0-85019070199,Mengfei Fan,Beijing
"Department of System Science and the Energy Challenge, Fondation Electricité de France, Université Paris-Saclay",In HAL (Valid),419361,Université Paris-Saclay,,,2-s2.0-85028928243,Enrico Zio,Chatenay-Malabry
"System Science and the Energy Challenge, Fondation Électricité de France (EDF), CentraleSupeléc, Université Paris-Saclay",In HAL (Valid),"419361, 411575",Université Paris-Saclay | CentraleSupélec,,,2-s2.0-85046667164,Enrico Zio,Gif-sur-Yvette
"EDF RandD, PERICles (Performance et Prevention des Risques Industriels du Parc Par la Simulation et les Etudes), EDF, Lab Paris Saclay",In HAL (Valid),"302313, 528389",EDF [EDF] | EDF R&D [EDF R&D],,,2-s2.0-85046618602,Dominique Vasseur,Palaiseau
"Chair on Systems Science and Energetic Challenge, Fondation Electricité de France (EDF), CentraleSupelec, Universite’ Paris-Saclay",In HAL (Valid),"419361, 411575",Université Paris-Saclay | CentraleSupélec,,,2-s2.0-84994226072,Enrico Zio,
"School of Management and Economics, Beijing Institute of Technology",In HAL (Valid),74978,Beijing Institute of Technology [BIT],,,2-s2.0-84997497801,Lirong Cui,Beijing
"System Science and the Energy Challenge, Fondation Electricité de France (EDF), CentraleSupélec, Université Paris Saclay",In HAL (Valid),"419361, 411575",Université Paris-Saclay | CentraleSupélec,,,2-s2.0-85013638280,Enrico Zio,Chatenay-Malabry
"Department System Science and the Energy Challenge, Fondation Electricité de France (EDF), CentraleSupélec, Université Paris Saclay",In HAL (Valid),"419361, 411575",Université Paris-Saclay | CentraleSupélec,,,2-s2.0-85013149404,Enrico Zio,Chatenay-Malabry
"Energy Department, Politecnico di Milano",In HAL (Valid),125443,Politecnico di Milano [Milan] [POLIMI],,,2-s2.0-85013149404,Francesco Di Maio,Milano
"Fondation Electricite de France (EDF), CentraleSupelec, Universite Paris-Saclay",In HAL (Valid),"419361, 411575",Université Paris-Saclay | CentraleSupélec,,,2-s2.0-85061377838,Enrico Zio,Paris
"China Center for Resilience and Safety of Critical Infrastructures, Beihang University",In HAL (Valid),411674,Beihang University [BUAA],,,2-s2.0-85061349671,Mengfei Fan,Beijing
"France Energy Department, Politecnico di Milano",In HAL (Valid),125443,Politecnico di Milano [Milan] [POLIMI],,,2-s2.0-85061349671,Enrico Zio,Milano
"Center for Resilience and Safety of Critical Infrastructures, Beihang University",In HAL (Valid),411674,Beihang University [BUAA],,,2-s2.0-85016216964,S.J. Du,Beijing
"Fondation Electricite de France (EDF), CentraleSuplec, Université Paris-Saclay",Not in HAL,,,,,2-s2.0-85016216964,Z.G. Zeng,Chatenay-Malabry
"Fondation Electricite de France (EDF), CentraleSupelec, Universite Paris-Saclay",In HAL (Valid),"419361, 411575",Université Paris-Saclay | CentraleSupélec,,,2-s2.0-85016177939,Z.G. Zeng,
"Ecole Centrale Pekin, Beihang University",In HAL (Valid),"411674, 302496, 217732",Ecole Centrale de Pékin | Fondation Bru | Beihang University [BUAA],,,2-s2.0-85180543234,Jinming Liu,Beijing
"Université Paris-Saclay, CentraleSupélec, Laboratory of Industrial Engineering",In HAL (Valid),"419361, 411575",CentraleSupélec | Université Paris-Saclay,,,2-s2.0-85180543234,Jakob Puchinger,Gif-sur-Yvette
"EM Normandie Business School, Métis Lab",In HAL (Valid),"150910, 301735",Métis Lab EM Normandie | École de Management de Normandie [EM Normandie],,,2-s2.0-85180543234,Jakob Puchinger,Clichy
"School of Architecture, Harbin Institute of Technology",In HAL (Valid),380001,Harbin Institute of Technology [HIT],,,2-s2.0-85178143927,Ding Mao,Harbin
"Key Laboratory of Cold Region Urban and Rural Human Settlement Environment Science and Technology, Ministry of Industry and Information Technology",Not in HAL,,,,,2-s2.0-85178143927,Ding Mao,Harbin
"CentraleSupélec, université Paris-Saclay, Laboratoire Genie Industriel",In HAL (Valid),"419361, 1043712, 411575",Laboratoire Génie Industriel [LGI] | CentraleSupélec | Université Paris-Saclay,,,2-s2.0-85176261850,David Lowing,Gif-sur-Yvette
"Univ Lyon, UJM Saint-Etienne, GATE UMR 5824",In HAL (Valid),"441569, 33804, 300284, 1169844",Université Lumière - Lyon 2 [UL2] | Université Jean Monnet - Saint-Étienne [UJM] | Centre National de la Recherche Scientifique [CNRS] | Groupe d'Analyse et de Théorie Economique Lyon - Saint-Etienne [GATE Lyon Saint-Étienne],,,2-s2.0-85176261850,David Lowing,Saint- Etienne
"Laboratoire d'Informatique Médicale et d'Ingénierie des Connaissances pour la e-Santé (LIMICS), Université Sorbonne Paris Nord, Sorbonne Université, Inserm",In HAL (Valid),"303623, 581146, 413221",Université Sorbonne Paris Nord | Sorbonne Université [SU] | Institut National de la Santé et de la Recherche Médicale [INSERM],,,2-s2.0-85167357118,Emmanuelle Kempf,Paris
"Department of Medical Oncology, Assistance Publique – Hôpitaux de Paris, Henri Mondor and Albert Chenevier Teaching Hospital, Université Paris Est Créteil",In HAL (Valid),"300068, 420786",Assistance publique - Hôpitaux de Paris (AP-HP) [AP-HP] | Université Paris-Est Créteil Val-de-Marne - Paris 12 [UPEC UP12],,,2-s2.0-85167357118,Emmanuelle Kempf,Créteil
"IT Department, Assistance Publique – Hôpitaux de Paris, Innovation and Data",In HAL (Valid),300068,Assistance publique - Hôpitaux de Paris (AP-HP) [AP-HP],,,2-s2.0-85167357118,Sonia Priou,Paris
"Université Paris-Saclay, CentraleSupélec, Laboratoire Génie Industriel",In HAL (Valid),"419361, 1043712, 411575",Laboratoire Génie Industriel [LGI] | CentraleSupélec | Université Paris-Saclay,,,2-s2.0-85167357118,Sonia Priou,Gif-sur-Yvette
"Department of Digestive Surgery, Assistance Publique – Hôpitaux de Paris, Henri Mondor and Albert Chenevier Teaching Hospital, Université Paris Est Créteil",In HAL (Valid),"300068, 420786",Assistance publique - Hôpitaux de Paris (AP-HP) [AP-HP] | Université Paris-Est Créteil Val-de-Marne - Paris 12 [UPEC UP12],,,2-s2.0-85167357118,Alexis Laurent,Créteil
"Department of Digestive Surgery, Assistance Publique – Hôpitaux de Paris, Cochin Teaching Hospital, Université Paris City",In HAL (Valid),300068,Assistance publique - Hôpitaux de Paris (AP-HP) [AP-HP],,,2-s2.0-85167357118,Stylianos Tzedakis,Paris
"Department of Medical Informatics, Assistance Publique – Hôpitaux de Paris, Centre-Université de Paris (APHP-CUP), Université de Paris",In HAL (Valid),"300068, 420786",Assistance publique - Hôpitaux de Paris (AP-HP) [AP-HP] | Université Paris-Est Créteil Val-de-Marne - Paris 12 [UPEC UP12],,,2-s2.0-85167357118,Gilles Chatellier,Paris
"Department of Medical Oncology, Assistance Publique – Hôpitaux de Paris, Tenon Teaching Hospital, Université Sorbonne",In HAL (Valid),"300068, 413221",Assistance publique - Hôpitaux de Paris (AP-HP) [AP-HP] | Sorbonne Université [SU],,,2-s2.0-85167357118,Gilles Galula,Paris
"Department of Medical Information, Assistance Publique – Hôpitaux de Paris",In HAL (Valid),300068,Assistance publique - Hôpitaux de Paris (AP-HP) [AP-HP],,,2-s2.0-85167357118,Rémi Flicoteaux,Paris
"Laboratoire Genie Industriel, CentraleSupélec, Université́ Paris-Saclay",In HAL (Valid),"419361, 1043712, 411575",Laboratoire Génie Industriel [LGI] | CentraleSupélec | Université Paris-Saclay,,,2-s2.0-85177747258,Tjark Gall,Gif-Sur-Yvette
IRT SystemX,In HAL (Valid),363822,IRT SystemX,,,2-s2.0-85177747258,Tjark Gall,Gif-Sur-Yvette
"Assistance Publique – Hôpitaux de Paris, Innovation and Data, IT Department",In HAL (Valid),300068,Assistance publique - Hôpitaux de Paris (AP-HP) [AP-HP],,,2-s2.0-85177175800,Etienne Guével,Paris
"Assistance Publique – Hôpitaux de Paris, Department of medical information",In HAL (Valid),300068,Assistance publique - Hôpitaux de Paris (AP-HP) [AP-HP],,,2-s2.0-85177175800,Rémi Flicoteaux,Paris
"Université Sorbonne Paris Nord, Laboratoire d'Informatique Médicale et d'Ingénierie des Connaissances pour la e-Santé, LIMICS",In HAL (Valid),"303623, 1001042, 581146, 413221",Université Sorbonne Paris Nord | Sorbonne Université [SU] | Institut National de la Santé et de la Recherche Médicale [INSERM] | Laboratoire d'Informatique Médicale et Ingénierie des Connaissances en e-Santé [LIMICS],,,2-s2.0-85177175800,Xavier Tannier,Paris
