"Authors","Author full names","Author(s) ID","Title","Year","Source title","Volume","Issue","Art. No.","Page start","Page end","Page count","Cited by","DOI","Link","Affiliations","Authors with affiliations","Abstract","Author Keywords","Index Keywords","Molecular Sequence Numbers","Chemicals/CAS","Tradenames","Manufacturers","Funding Details","Funding Texts","Correspondence Address","Editors","Publisher","Sponsors","Conference name","Conference date","Conference location","Conference code","ISSN","ISBN","CODEN","PubMed ID","Language of Original Document","Abbreviated Source Title","Document Type","Publication Stage","Open Access","Source","EID"
"Belaid Y.N.; Fang Y.; Zeng Z.; Coudray P.; Barros A.","Belaid, Youba Nait (57224087723); Fang, Yiping (55659850100); Zeng, Zhiguo (55348807500); Coudray, Patrick (57224084974); Barros, Anne (7102745133)","57224087723; 55659850100; 55348807500; 57224084974; 7102745133","Restoration Modeling and Optimization of Hybrid Overhead-Underground Power Distribution Systems","2023","2023 IEEE Power and Energy Society Innovative Smart Grid Technologies Conference, ISGT 2023","","","","","","","0","10.1109/ISGT51731.2023.10066340","https://www.scopus.com/inward/record.uri?eid=2-s2.0-85151498277&doi=10.1109%2fISGT51731.2023.10066340&partnerID=40&md5=9bfe0d60d623be55b42a30b37f9dc8a8","University Paris Saclay, CentraleSupélec, Paris, France; Electricité de France (EDF) R&d, Paris, France","Belaid Y.N., University Paris Saclay, CentraleSupélec, Paris, France, Electricité de France (EDF) R&d, Paris, France; Fang Y., Electricité de France (EDF) R&d, Paris, France; Zeng Z., Electricité de France (EDF) R&d, Paris, France; Coudray P., University Paris Saclay, CentraleSupélec, Paris, France; Barros A., Electricité de France (EDF) R&d, Paris, France","Disaster awareness increased in recent years among power system stakeholders to face many natural, technical, and malicious adversities. The smart distribution grid (SDG) is thereby at the core of proposed system enhancements, due to its high fragility as well as being the interface to most newly intro-duced grid applications (distributed energy resources, electrical vehicles, industrial Internet-of- Things, etc.). The SDG can be characterized by the type of lines composing the feeders (over-head and/or underground) and deployed intelligent electronic devices (IED) that allow efficient monitoring, protection, and control of the system. This paper proposes an optimization formulation to enhance the resilience of overhead and underground networks, while considering the coupling between power grid operation and the communicating remote-controlled switches (RCS). Novel radiality constraints are introduced to guarantee the tree structure during operation. Results from testing the model in a real network show the validity of proposed radiality constraints and quantify the gap in terms of achieved resilience between full overhead and hybrid overhead-underground networks.  © 2023 IEEE.","Communication; Optimization; Overhead and Under-ground Networks; Radiality; Resilience; Smart Grid","Electric power distribution; Electric power system control; Electric power system protection; Energy resources; Overhead lines; Remote control; Trees (mathematics); Ground networks; Modeling and optimization; Optimisations; Overhead and under-ground network; Radiality; Resilience; Restoration model; Smart distribution grids; Smart grid; Underground networks; Smart power grids","","","","","","","; ","","Institute of Electrical and Electronics Engineers Inc.","","2023 IEEE Power and Energy Society Innovative Smart Grid Technologies Conference, ISGT 2023","16 January 2023 through 19 January 2023","Washington","187411","","978-166545355-4","","","English","IEEE Power Energy Soc. Innov. Smart Grid Technol. Conf., ISGT","Conference paper","Final","","Scopus","2-s2.0-85151498277"
"Boujarif A.; Coit D.W.; Jouini O.; Zeng Z.; Heidsieck R.","Boujarif, Abdelhamid (57266980700); Coit, David W. (7006816402); Jouini, Oualid (18535501100); Zeng, Zhiguo (55348807500); Heidsieck, Robert (57225292497)","57266980700; 7006816402; 18535501100; 55348807500; 57225292497","Opportunistic Maintenance of Multi-Component Systems Under Structure and Economic Dependencies: A Healthcare System Case Study","2023","International Conference on Operations Research and Enterprise Systems","","","","158","166","8","0","10.5220/0011669800003396","https://www.scopus.com/inward/record.uri?eid=2-s2.0-85172788020&doi=10.5220%2f0011669800003396&partnerID=40&md5=ef445c5a3796882c43e896df549d260f","Industrial Engineering Laboratory (LGI) CentraleSupèlec, Paris-Saclay University, Gif-sur-Yvette, France; Department of Industrial and Systems Engineering, Rutgers University, United States; General Electric Healthcare, 283 Rue de la Minière, Buc, 78530, France","Boujarif A., Industrial Engineering Laboratory (LGI) CentraleSupèlec, Paris-Saclay University, Gif-sur-Yvette, France; Coit D.W., Department of Industrial and Systems Engineering, Rutgers University, United States; Jouini O., Industrial Engineering Laboratory (LGI) CentraleSupèlec, Paris-Saclay University, Gif-sur-Yvette, France; Zeng Z., Industrial Engineering Laboratory (LGI) CentraleSupèlec, Paris-Saclay University, Gif-sur-Yvette, France; Heidsieck R., General Electric Healthcare, 283 Rue de la Minière, Buc, 78530, France","This paper presents an opportunistic maintenance model for a multi-component system. We develop a model that considers the ages and residual values of the non-failed components and component failure time distributions. We also consider the structural and economical dependency between the items by favoring grouped over individual replacement to reduce operation costs. We use a genetic algorithm to derive the optimal opportunistic maintenance plan by minimizing the long-run operational cost considering both maintenance cost and potential penalty costs due to failure in the future. The model recommends additional preventive operations in cases where the reliability does not satisfy the quality condition and to reduce the long-run operational cost. A sensitivity analysis shows that the optimal decision is mainly affected by the logistic cost, the interest rate, and the planning horizon. The model’s performance has been evaluated using several real case problems, demonstrating that the proposed method is very efficient. © 2023 by SCITEPRESS–Science and Technology Publications, Lda.","Economic Dependence; Multi-Component Systems; Opportunistic Maintenance; Reliability; Structure","","","","","","SNCF; Orange; Université Paris-Saclay; Electricité de France, EDF","The research of Zhiguo Zeng is partially financially supported by ANR under grant number ANR-22-CE10-0004 and the chaire of Risk and Resilience of Complex Systems (Chaire EDF, Orange and SNCF). The participation of David Coit in this research is partially financed by the international visiting grant from Centralesupélec, and the Bourses Jean d’Alembert from Université Paris-Saclay.","","Liberatore F.; Wesolkowski S.; Parlier G.H.","Science and Technology Publications, Lda","","12th International Conference on Operations Research and Enterprise Systems, ICORES 2023","19 February 2023 through 21 February 2023","Lisbon","300909","21844372","978-989758627-9","","","English","Int. Conf. Op. Res. Enterp. Syst.","Conference paper","Final","All Open Access; Hybrid Gold Open Access","Scopus","2-s2.0-85172788020"
"Bani-Mustafa T.; Zeng Z.; Zio E.; Vasseur D.","Bani-Mustafa, Tasneem (57201984857); Zeng, Zhiguo (55348807500); Zio, Enrico (7005289082); Vasseur, Dominique (55919360700)","57201984857; 55348807500; 7005289082; 55919360700","Strength of knowledge assessment for risk informed decision making","2018","Safety and Reliability - Safe Societies in a Changing World - Proceedings of the 28th International European Safety and Reliability Conference, ESREL 2018","","","","93","102","9","1","","https://www.scopus.com/inward/record.uri?eid=2-s2.0-85058108917&partnerID=40&md5=f137a740d81f98b01055baaf1c481dfb","EDF Foundation, Laboratoire Genie Industriel, CentraleSupélec, Université Paris-Saclay, France; Energy Department, Politecnico di Milano, Italy; EDF R&D, PERICLES (Performance et Prévention des Risques Industriels du Parc par la Simulation et les Etudes), EDF Lab Paris Saclay, France","Bani-Mustafa T., EDF Foundation, Laboratoire Genie Industriel, CentraleSupélec, Université Paris-Saclay, France; Zeng Z., EDF Foundation, Laboratoire Genie Industriel, CentraleSupélec, Université Paris-Saclay, France; Zio E., EDF Foundation, Laboratoire Genie Industriel, CentraleSupélec, Université Paris-Saclay, France, Energy Department, Politecnico di Milano, Italy; Vasseur D., EDF R&D, PERICLES (Performance et Prévention des Risques Industriels du Parc par la Simulation et les Etudes), EDF Lab Paris Saclay, France","Risk Informed Decision Making (RIDM) is based on risk metrics obtained from a Probabilistic Risk Assessment (PRA). For plants exposed to multiple hazards, Multi-Hazards Risk Aggregation (MHRA) is necessary to inform decisions. In practice, this is often done by a simple arithmetic summation over the different risk contributors, without taking into account that the state of knowledge of the risk models of the different hazards can be quite different. In this paper, we provide a hierarchical framework to assess the strength of knowledge that PRA models are based upon. The framework is organized in three attributes characterizing the knowledge which a PRA model is based upon (assumptions, data, phenomenological understanding). These attributes are further broken down into sub-attributes and, finally, “leaf ” attributes that can be evaluated. The PRA models of two hazards groups for Nuclear Power Plants (NPPs) are considered and the strength of knowledge behind each model is assessed using the developed framework. © 2018 Taylor & Francis Group, London.","","Decision making; Hazards; Nuclear fuels; Nuclear power plants; Reliability; Broken down; Knowledge assessment; Multi-hazards; Multiple hazards; Probabilistic Risk Assessment; Risk aggregations; Risk metrics; Risk-informed decision making; Risk assessment","","","","","","","","van Gulijk C.; Haugen S.; Barros A.; Vinnem J.E.; Kongsvik T.","CRC Press/Balkema","","28th International European Safety and Reliability Conference, ESREL 2018","17 June 2018 through 21 June 2018","Trondheim","220589","","978-081538682-7","","","English","Saf. Reliab. - Safe Soc. Chang. World - Proc. Int. Eur. Saf. Reliab. Conf.","Conference paper","Final","","Scopus","2-s2.0-85058108917"
"Zeng Z.; Zio E.","Zeng, Zhiguo (55348807500); Zio, Enrico (7005289082)","55348807500; 7005289082","Assessing reliability reputation of products based on online customer reviews","2020","Proceedings of the 29th European Safety and Reliability Conference, ESREL 2019","","","","157","162","5","0","10.3850/978-981-11-2724-30979-cd","https://www.scopus.com/inward/record.uri?eid=2-s2.0-85089179250&doi=10.3850%2f978-981-11-2724-30979-cd&partnerID=40&md5=e48b903be2db4d74e05d62c3685bb4d5","System Science and the Energy Challenge, Fondation Électricité de France (EDF), Laboratoire Genie Industriel, CentraleSupélec, Université Paris-Saclay, France; Crisis and Risk Research Centre, Ecole des Mines de Paris, MINES ParisTech, France; Dipartimento di Energia, Politecnico di Milano, Italy","Zeng Z., System Science and the Energy Challenge, Fondation Électricité de France (EDF), Laboratoire Genie Industriel, CentraleSupélec, Université Paris-Saclay, France; Zio E., Crisis and Risk Research Centre, Ecole des Mines de Paris, MINES ParisTech, France, Dipartimento di Energia, Politecnico di Milano, Italy","The traditional concept of functional reliability refers to the ability of an item to perform a required function without failure, under stated conditions for a stated period of time. Numerical indexes of functional reliability are estimated from laboratory test data or field failure data. Theses indexes are not always available to the customers. On the other hand, reliability reputation, which concerns the opinions of the general public regarding the functional performance of a given product, is dominant in affecting the purchase willingness of the customers. In this paper, we develop a new method for evaluating the reliability reputation of a given product. Numerical metrics are first defined to measure reliability reputation. Online customer's reviews are collected and used as data for reliability reputation assessment. Text mining algorithms are used to extract information regarding the reliability of the product and the maintenance service of the company. Finally, an integrated approach is proposed to evaluate the reliability reputation. A case study is conducted to demonstrate the validity of the developed methods. Copyright © 2019 European Safety and Reliability Association.","Online reviews; Reliability assessment; Reliability reputation; Text mining; Web-based data","Sales; Text mining; Extract informations; Field failure data; Functional performance; Integrated approach; Maintenance services; Online customer reviews; Online customers; Reputation assessments; Reliability","","","","","","","","Beer M.; Zio E.","Research Publishing Services","Exida.com LLC; Grossraum-Verkehr Hannover GmbH; Safety Tools Development (SATODEV)","29th European Safety and Reliability Conference, ESREL 2019","22 September 2019 through 26 September 2019","Hannover","161291","","978-981112724-3","","","English","Proc. Euro. Saf. Reliab. Conf., ESREL","Conference paper","Final","","Scopus","2-s2.0-85089179250"
"Xiahou T.; Liu Y.; Zeng Z.; Wu M.","Xiahou, Tangfan (57202959803); Liu, Yu (57116628700); Zeng, Zhiguo (55348807500); Wu, Muchen (57812856400)","57202959803; 57116628700; 55348807500; 57812856400","Remaining useful life prediction with imprecise observations: An interval particle filtering approach","2023","IISE Transactions","55","11","","1075","1090","15","4","10.1080/24725854.2022.2125602","https://www.scopus.com/inward/record.uri?eid=2-s2.0-85141134865&doi=10.1080%2f24725854.2022.2125602&partnerID=40&md5=db3d5dd46ce5fee8d5574980bf96e4a0","School of Mechanical and Electrical Engineering, University of Electronic Science and Technology of China, Chengdu, China; Center for System Reliability and Safety, University of Electronic Science and Technology of China, Chengdu, China; EDF Foundation Chair on Systems Science and Energetic Challenge, CentraleSupelec, Universite Paris-Saclay, Chatenay-Malabry, France","Xiahou T., School of Mechanical and Electrical Engineering, University of Electronic Science and Technology of China, Chengdu, China, Center for System Reliability and Safety, University of Electronic Science and Technology of China, Chengdu, China; Liu Y., School of Mechanical and Electrical Engineering, University of Electronic Science and Technology of China, Chengdu, China, Center for System Reliability and Safety, University of Electronic Science and Technology of China, Chengdu, China; Zeng Z., EDF Foundation Chair on Systems Science and Energetic Challenge, CentraleSupelec, Universite Paris-Saclay, Chatenay-Malabry, France; Wu M., School of Mechanical and Electrical Engineering, University of Electronic Science and Technology of China, Chengdu, China","Particle Filtering (PF) has been widely used for predicting Remaining Useful Life (RUL) of industrial products, especially for those with nonlinear degradation behavior and non-Gaussian noise. Traditional PF is a recursive Bayesian filtering framework that updates the posterior probability density function of RULs when new observation data become available. In engineering practice, due to the limited accuracy of monitoring/inspection techniques, the observation data available for PF are inevitably imprecise and often need to be treated as interval data. In this article, a novel Interval Particle Filtering (IPF) approach is proposed to effectively leverage such interval-valued observations for RUL prediction. The IPF is built on three pillars: (i) an interval contractor that mitigates the error explosion problem when the epistemic uncertainty in the interval-valued observation data is propagated; (ii) an interval intersection method for constructing the likelihood function based on the interval observation data; and (iii) an interval kernel smoothing algorithm for estimating the unknown parameters in the IPF. The developed methods are applied on the interval-valued capacity data of batteries and fatigue crack growth data of railroad tracks. The results demonstrate that the developed methods could improve the performance of RUL predictions based on interval observation data. © Copyright © 2022 “IISE”.","epistemic uncertainty; imprecise observation; interval kernel smoothing; Interval particle filtering; remaining useful life","Forecasting; Gaussian noise (electronic); Monte Carlo methods; Probability density function; Uncertainty analysis; Epistemic uncertainties; Imprecise observation; Interval kernel smoothing; Interval particle filtering; Interval-valued; Kernel smoothing; Observation data; Particle Filtering; Remaining useful life predictions; Remaining useful lives; Fatigue crack propagation","","","","","","","Y. Liu; School of Mechanical and Electrical Engineering, University of Electronic Science and Technology of China, Chengdu, China; email: yuliu@uestc.edu.cn","","Taylor and Francis Ltd.","","","","","","24725854","","","","English","IISE Trans.","Article","Final","","Scopus","2-s2.0-85141134865"
"Mitici M.; de Pater I.; Barros A.; Zeng Z.","Mitici, Mihaela (56102768600); de Pater, Ingeborg (57223651872); Barros, Anne (7102745133); Zeng, Zhiguo (55348807500)","56102768600; 57223651872; 7102745133; 55348807500","Dynamic predictive maintenance for multiple components using data-driven probabilistic RUL prognostics: The case of turbofan engines","2023","Reliability Engineering and System Safety","234","","109199","","","","7","10.1016/j.ress.2023.109199","https://www.scopus.com/inward/record.uri?eid=2-s2.0-85149406585&doi=10.1016%2fj.ress.2023.109199&partnerID=40&md5=81730f1810546c94baae4abc39a6d244","Faculty of Science, Utrecht University, Heidelberglaan 8, CS Utrecht, 3584, Netherlands; Faculty of Aerospace Engineering, Delft University of Technology, Delft, HS 2926, Netherlands; Laboratoire Genie Industriel, CentraleSupélec, Université Paris-Saclay, 3 Rue Joliot Curie, Gif-sur-Yvette, 91190, France","Mitici M., Faculty of Science, Utrecht University, Heidelberglaan 8, CS Utrecht, 3584, Netherlands; de Pater I., Faculty of Aerospace Engineering, Delft University of Technology, Delft, HS 2926, Netherlands; Barros A., Laboratoire Genie Industriel, CentraleSupélec, Université Paris-Saclay, 3 Rue Joliot Curie, Gif-sur-Yvette, 91190, France; Zeng Z., Laboratoire Genie Industriel, CentraleSupélec, Université Paris-Saclay, 3 Rue Joliot Curie, Gif-sur-Yvette, 91190, France","The increasing availability of condition-monitoring data for components/systems has incentivized the development of data-driven Remaining Useful Life (RUL) prognostics in the past years. However, most studies focus on point RUL prognostics, with limited insights into the uncertainty associated with these estimates. This limits the applicability of such RUL prognostics to maintenance planning, which is per definition a stochastic problem. In this paper, we therefore develop probabilistic RUL prognostics using Convolutional Neural Networks. These prognostics are further integrated into maintenance planning, both for single and multiple components. We illustrate our approach for aircraft turbofan engines. The results show that the optimal replacement time for the engines is close to the lower bound of the 99% confidence interval of the RUL estimates. We also show that our proposed maintenance approach leads to a cost reduction of 53% compared to a traditional Time-based maintenance strategy. Moreover, compared with the ideal case when the true RUL is known in advance (perfect RUL prognostics), our approach leads to a limited number of failures. Overall, this paper proposes an end-to-end framework for data-driven predictive maintenance for multiple components, and showcases the potential benefits of data-driven predictive maintenance on cost and reliability. © 2023 The Author(s)","Aircraft; C-MAPSS turbofan engines; Maintenance scheduling; Predictive maintenance planning; Probabilistic remaining useful life prognostics","Aircraft engines; Condition based maintenance; Condition monitoring; Cost reduction; Turbofan engines; Uncertainty analysis; C-MAPSS turbofan engine; Data driven; Maintenance planning; Maintenance scheduling; Multiple components; Predictive maintenance; Predictive maintenance planning; Probabilistic remaining useful life prognostic; Probabilistics; Remaining useful lives; Stochastic systems","","","","","SNCF; EDF Energy","The research contribution of Anne Barros and Zhiguo Zeng is partially supported by Chair of Risk and Resilience of Complex Systems (Chair EDF, SNCF and Orange), France .","M. Mitici; Faculty of Science, Utrecht University, CS Utrecht, Heidelberglaan 8, 3584, Netherlands; email: m.a.mitici@uu.nl","","Elsevier Ltd","","","","","","09518320","","RESSE","","English","Reliab Eng Syst Saf","Article","Final","All Open Access; Green Open Access; Hybrid Gold Open Access","Scopus","2-s2.0-85149406585"
"Xing J.; Zeng Z.; Zio E.","Xing, Jinduo (57193733355); Zeng, Zhiguo (55348807500); Zio, Enrico (7005289082)","57193733355; 55348807500; 7005289082","Joint optimization of safety barriers for enhancing business continuity of nuclear power plants against steam generator tube ruptures accidents","2020","Reliability Engineering and System Safety","202","","107067","","","","11","10.1016/j.ress.2020.107067","https://www.scopus.com/inward/record.uri?eid=2-s2.0-85086595566&doi=10.1016%2fj.ress.2020.107067&partnerID=40&md5=29bea1cad714613418a7446f49839606","Chair Risk and Resilience of Complex Systems, Laboratoire Génie Industriel (LGI), CentraleSupélec, Université Paris Saclay, Gif-sur-Yvette, France; MINES ParisTech, PSL Research University, CRC, Sophia Antipolis, France; Energy Department, Politecnico di Milano, Milan, Italy; Eminent Scholar, Department of Nuclear Engineering, College of Engineering, Kyung Hee University, South Korea","Xing J., Chair Risk and Resilience of Complex Systems, Laboratoire Génie Industriel (LGI), CentraleSupélec, Université Paris Saclay, Gif-sur-Yvette, France; Zeng Z., Chair Risk and Resilience of Complex Systems, Laboratoire Génie Industriel (LGI), CentraleSupélec, Université Paris Saclay, Gif-sur-Yvette, France; Zio E., MINES ParisTech, PSL Research University, CRC, Sophia Antipolis, France, Energy Department, Politecnico di Milano, Milan, Italy, Eminent Scholar, Department of Nuclear Engineering, College of Engineering, Kyung Hee University, South Korea","In nuclear power plants (NPPs), different types of safety barriers are designed to ensure the safe and continuous operation of the NPP against disruptive events. These safety barriers, although designed to operate in different phases of the accidents evolution, are often optimized separately, without considering their collective effects on preventing disruptions and quickly recovering from the disruptions. This paper develops a joint optimization model for synthetically optimizing safety barriers of different natures, including prevention, mitigation, emergency and recovery barriers to enhance the business continuity of the NPP, considering the threat of steam generator tube rupture (SGTR) accidents. The joint optimization is guided by a business continuity metric called expected business continuity value (EBCV). A physics-of-failure model is developed to describe the crack growth process of the steam generator tube and to model the effect of the prevention barriers, i.e., periodical inspection of the crack length. An event tree model is developed to describe the evolution of the SGTR-initiated accident and to model the effect of the mitigation and emergency barriers. Recovery measures are also considered via a widely-used logarithmic function model. A mixed-integer genetic algorithm (MIGA) is used to obtain optimal solutions of the joint optimization model. The results show that the developed joint optimization model can achieve better performance in terms of business continuity, compared to the conventional methods that optimize the safety barriers separately. © 2020 Elsevier Ltd","Business continuity management (BCM); Event tree (ET); Joint optimization; Mixed-integer genetic algorithm (MIGA); Nuclear power plant (NPP); Safety barrier; Steam generator tube rupture (SGTR)","Descaling; Genetic algorithms; Integer programming; Nuclear energy; Nuclear fuels; Nuclear power plants; Nuclear reactor accidents; Recovery; Steam power plants; Tubes (components); Uncertainty analysis; Continuous operation; Conventional methods; Logarithmic functions; Mixed-integer genetic algorithms; Periodical inspection; Physics of failure models; Steam generator tube; Steam generator tube ruptures; Steam generators","","","","","China Scholarship Council, CSC, (201506450020)","The work of Dr. Jinduo Xing is supported by China Scholarship Council (No. 201506450020).","Z. Zeng; Chair Risk and Resilience of Complex Systems, Laboratoire Génie Industriel (LGI), CentraleSupélec, Université Paris Saclay, Gif-sur-Yvette, France; email: zhiguo.zeng@centralesupelec.fr","","Elsevier Ltd","","","","","","09518320","","RESSE","","English","Reliab Eng Syst Saf","Article","Final","All Open Access; Bronze Open Access","Scopus","2-s2.0-85086595566"
