"Bellè A.; Zeng Z.; Sango M.; Barros A.","Bellè, Andrea (57286978200); Zeng, Zhiguo (55348807500); Sango, Marc (55353671400); Barros, Anne (7102745133)","57286978200; 55348807500; 55353671400; 7102745133","Towards a realistic topological and functional modeling for vulnerability analysis of interdependent railway and power networks","2021","Proceedings of the 31st European Safety and Reliability Conference, ESREL 2021","","","","2063","2070","7","1","10.3850/978-981-18-2016-8_356-cd","https://www.scopus.com/inward/record.uri?eid=2-s2.0-85135437717&doi=10.3850%2f978-981-18-2016-8_356-cd&partnerID=40&md5=639821280b3c10492b1fedc1b223590d","Laboratoire Génie Industriel, CentraleSupélec, Université Paris-Saclay, France; SNCF, Direction Technologies Innovation et Projet Groupe, Innovation & Recherche, Département Physique du Système Ferroviaire, Equipe Sécurité Système, France","Bellè A., Laboratoire Génie Industriel, CentraleSupélec, Université Paris-Saclay, France; Zeng Z., Laboratoire Génie Industriel, CentraleSupélec, Université Paris-Saclay, France; Sango M., SNCF, Direction Technologies Innovation et Projet Groupe, Innovation & Recherche, Département Physique du Système Ferroviaire, Equipe Sécurité Système, France; Barros A., Laboratoire Génie Industriel, CentraleSupélec, Université Paris-Saclay, France","Railway systems and power grids are recognized as two of the most important critical infrastructures. The majority of European railway networks are electrified, and power transmission networks represent usually the main power supplier. Railway and power networks share thus a unidirectional interdependency, as the railway network functionality depends on the power network. Due to this interdependency, failures in power networks have the potential of causing vast disruption in the dependent railway networks. Despite this, the issue of modeling interdependent railway and power networks has not been addressed sufficiently carefully in the existing literature. Furthermore, the treatment of cascading failures in power networks and their consequences in railway networks is limited and approximative. In this work, we propose a modeling framework which accounts for more realistic assumptions on the interconnections topology and the cascading failures dynamics. Firstly, we model the interconnections between the railway and external power network by introducing the traction power network, which acts as a bridge between the external power grid and the railway network. Secondly, we model cascading failures in the external and traction power networks with an approach based on the DC power flow model. Thirdly, we suggest a simple approach to estimate the negative consequences on the railway network due to load shedding in the traction power network. Vulnerability analysis is performed to estimate the negative consequences in the railway network due to different failure scenarios in the external power network. Sensitivity analysis on the initial assumptions is also performed. © ESREL 2021. Published by Research Publishing, Singapore.","Cascading failures; Critical infrastructures; Interdependent networks; Power network; Railway network; Vulnerability","Electric load flow; Electric load shedding; Electric power transmission; Electric power transmission networks; Network security; Public works; Railroads; Sensitivity analysis; Topology; Cascading failures; Functional modelling; Interdependent network; Power grids; Power networks; Railway network; Topological models; Traction power; Vulnerability; Vulnerability analysis; Critical infrastructures","","","","","SNCF; Electricité de France, EDF","The authors thank Dr. Yiping Fang for providing the data of the external power network. This work is funded by the Chair on Risk and Resilience of Complex Systems (CentraleSupélec, EDF, SNCF, Orange).","","Castanier B.; Cepin M.; Bigaud D.; Berenguer C.","Research Publishing, Singapore","","31st European Safety and Reliability Conference, ESREL 2021","19 September 2021 through 23 September 2021","Angers","279599","","978-981182016-8","","","English","Proc. Eur. Saf. Reliab. Conf.","Conference paper","Final","","Scopus","2-s2.0-85135437717"
"Bani-Mustafa T.; Zeng Z.; Zio E.; Vasseur D.","Bani-Mustafa, Tasneem (57201984857); Zeng, Zhiguo (55348807500); Zio, Enrico (7005289082); Vasseur, Dominique (55919360700)","57201984857; 55348807500; 7005289082; 55919360700","A framework for multi-hazards risk aggregation considering risk model maturity levels","2017","2017 2nd International Conference on System Reliability and Safety, ICSRS 2017","2018-January","","","429","433","4","5","10.1109/ICSRS.2017.8272859","https://www.scopus.com/inward/record.uri?eid=2-s2.0-85046618602&doi=10.1109%2fICSRS.2017.8272859&partnerID=40&md5=1f17e14c0c9a4dbc146dfea32e6ebf58","System Science and the Energetic Challenge, EDF Foundation, Laboratoire Genie Industriel, CentraleSupélec, Université Paris-Saclay, 3 Rue Joliot Curie, Gif-sur-Yvette, 91190, France; Energy Department, Politecnico di Milano, Via Ponzio 34/3, Milan, 20133, Italy; EDF RandD, PERICles (Performance et Prevention des Risques Industriels du Parc Par la Simulation et les Etudes), EDF, Lab Paris Saclay, 7 Bd Gaspard Monge, Palaiseau, 91120, France","Bani-Mustafa T., System Science and the Energetic Challenge, EDF Foundation, Laboratoire Genie Industriel, CentraleSupélec, Université Paris-Saclay, 3 Rue Joliot Curie, Gif-sur-Yvette, 91190, France; Zeng Z., System Science and the Energetic Challenge, EDF Foundation, Laboratoire Genie Industriel, CentraleSupélec, Université Paris-Saclay, 3 Rue Joliot Curie, Gif-sur-Yvette, 91190, France; Zio E., System Science and the Energetic Challenge, EDF Foundation, Laboratoire Genie Industriel, CentraleSupélec, Université Paris-Saclay, 3 Rue Joliot Curie, Gif-sur-Yvette, 91190, France, Energy Department, Politecnico di Milano, Via Ponzio 34/3, Milan, 20133, Italy; Vasseur D., EDF RandD, PERICles (Performance et Prevention des Risques Industriels du Parc Par la Simulation et les Etudes), EDF, Lab Paris Saclay, 7 Bd Gaspard Monge, Palaiseau, 91120, France","Multi-Hazards Risk Aggregation (MHRA) aggregates risk over different risk contributors and provides a final risk index that permits the comparison with safety guidelines to support Decision Making (DM). Maturity of the risk analysis are always different for different risk contributors, resulting in different degrees of confidence on the associated results. The difference in maturity, and the sources of heterogeneity that cause such differences, should be taken into account for supporting a reliable and accurate representation of risk in respect of DM. In this paper, we first propose a hierarchical framework to evaluate the level of maturity of risk assessments in respect of DM. The framework consists of different attributes (uncertainty, conservatism, knowledge and sensitivity) and sub-attributes (availability of data, consistency of data, data reliability, experience, and value ladenness) that are believed to determine the level of maturity of a risk assessment. Evaluation guidelines are pre-defined for facilitating the attributes scoring process. Then, the maturity level is integrated in MHRA by developing a two-dimensional risk aggregation method. Finally, a numerical case study for the MHRA of a Nuclear Power Plant (NPP) is carried out to show the applicability and the plausibility of the methods. © 2017 IEEE.","level of maturity; multi-hazards risk aggergation; probablistic safety assessment; risk assessment; risk-informed decision making","Decision making; Hazards; Nuclear fuels; Nuclear power plants; Numerical methods; Risk analysis; Hazard risks; Level of maturity; Multi-hazard risk aggergation; Multi-hazards; Probablistic; Probablistic safety assessment; Risk aggregations; Risk-informed decision making; Risks assessments; Safety assessments; Risk assessment","","","","","","","","","Institute of Electrical and Electronics Engineers Inc.","","2nd International Conference on System Reliability and Safety, ICSRS 2017","20 December 2017 through 22 December 2017","Milan","134455","","978-153863322-9","","","English","Int. Conf. Syst. Reliab. Saf., ICSRS","Conference paper","Final","All Open Access; Green Open Access","Scopus","2-s2.0-85046618602"
"Xing J.; Zeng Z.; Zio E.","Xing, Jinduo (57193733355); Zeng, Zhiguo (55348807500); Zio, Enrico (7005289082)","57193733355; 55348807500; 7005289082","An integrated framework for condition-informed probabilistic risk assessment","2017","Safety and Reliability - Theory and Applications - Proceedings of the 27th European Safety and Reliability Conference, ESREL 2017","","","","2841","2847","6","1","10.1201/9781315210469-361","https://www.scopus.com/inward/record.uri?eid=2-s2.0-85061355328&doi=10.1201%2f9781315210469-361&partnerID=40&md5=ce665e27bf92113c9c6fe4b4bd15fe92","Fondation Electricite de France (EDF), CentraleSupelec, Universite Paris-Saclay, Paris, France; Energy Department, Politecnico di Milano, Milano, Italy","Xing J., Fondation Electricite de France (EDF), CentraleSupelec, Universite Paris-Saclay, Paris, France; Zeng Z., Fondation Electricite de France (EDF), CentraleSupelec, Universite Paris-Saclay, Paris, France; Zio E., Fondation Electricite de France (EDF), CentraleSupelec, Universite Paris-Saclay, Paris, France, Energy Department, Politecnico di Milano, Milano, Italy","Traditional Probabilistic Risk Assessment (PRA) is based on techniques like Event Tree Analysis (ETA) and Fault Tree Analysis (FTA), which are considered static, i.e., the failure probabilities of the safety barriers do not take into account the system evolution in time, e.g., due to various degradation mechanisms, like fatigue, wear, corrosion, etc. On the other hand, condition-monitoring data are available in practice and can be used, possibly even for real-time updating. In this paper, we develop an integrated framework for condition-informed risk analysis. A conventional event tree model is used, in which some safety barriers are subject to degradation mechanisms and their failure probabilities are treated as time-dependent. Particle Filtering (PF) is used to update the failure probabilities of the safety barriers in real-time, based on the collected condition-monitoring data. The updated failure probabilities are, then, used in the event tree model. The developed framework also allows predicting the scenario probabilities in the future. To do this, the failure probabilities are updated and predicted by PF and, then integrated in the event tree. The developed framework is applied for condition-informed risk assessment of a high-level alarm equipment from literature. © 2017 Taylor & Francis Group, London.","","Condition monitoring; Corrosion; Corrosion fatigue; Degradation; Fault tree analysis; Reliability theory; Risk analysis; Safety engineering; Trees (mathematics); Condition-monitoring data; Degradation mechanism; Event tree analysis; Event tree modeling; Failure Probability; Fault tree analyses (FTA); Integrated frameworks; Probabilistic Risk Assessment; Risk assessment","","","","","","","","Cepin M.; Briš R.","CRC Press/Balkema","","27th European Safety and Reliability Conference, ESREL 2017","18 June 2017 through 22 June 2017","Portorož","220759","","978-113862937-0","","","English","Saf. Reliab. – Theory Appl. - Proc. Eur. Saf. Reliab. Conf.","Conference paper","Final","All Open Access; Green Open Access","Scopus","2-s2.0-85061355328"
"Du S.; Zeng Z.; Cui L.; Kang R.","Du, Shijia (55353331800); Zeng, Zhiguo (55348807500); Cui, Lirong (56003542200); Kang, Rui (57190489743)","55353331800; 55348807500; 56003542200; 57190489743","Reliability analysis of Markov history-dependent repairable systems with neglected failures","2017","Reliability Engineering and System Safety","159","","","134","142","8","23","10.1016/j.ress.2016.10.030","https://www.scopus.com/inward/record.uri?eid=2-s2.0-84997497801&doi=10.1016%2fj.ress.2016.10.030&partnerID=40&md5=9d4d35a42751ce49635f5321f9eab170","School of Reliability and Systems Engineering, Beihang University, Beijing, 100191, China; Chair System Science and the Energy Challenge, Fondation Electricité de France (EDF), CentraleSupélec, Université Paris-Saclay, Châtenay-Malabry, 92290, France; School of Management and Economics, Beijing Institute of Technology, Beijing, 100081, China","Du S., School of Reliability and Systems Engineering, Beihang University, Beijing, 100191, China; Zeng Z., Chair System Science and the Energy Challenge, Fondation Electricité de France (EDF), CentraleSupélec, Université Paris-Saclay, Châtenay-Malabry, 92290, France; Cui L., School of Management and Economics, Beijing Institute of Technology, Beijing, 100081, China; Kang R., School of Reliability and Systems Engineering, Beihang University, Beijing, 100191, China","Markov history-dependent repairable systems refer to the Markov repairable systems in which some states are changeable and dependent on recent evolutional history of the system. In practice, many Markov history-dependent repairable systems are subjected to neglected failures, i.e., some failures do not affect system performances if they can be repaired promptly. In this paper, we develop a model based on the theory of aggregated stochastic processes to describe the history-dependent behavior and the effect of neglected failures on the Markov history-dependent repairable systems. Based on the developed model, instantaneous and steady-state availabilities are derived to characterize the reliability of the system. Four reliability-related time distributions, i.e., distribution for the k th working period, distribution for the k th failure period, distribution for the real working time in an effective working period, distribution for the neglected failure time in an effective working period, are also derived to provide a more comprehensive description of the system's reliability. Thanks to the power of the theory of aggregated stochastic processes, closed-form expressions are obtained for all the reliability indexes and time distributions. Finally, the developed indexes and analysis methods are demonstrated by a numerical example. © 2016 Elsevier Ltd","Aggregated stochastic process; Availability; Markov history-dependent repairable systems; Markov repairable system; Neglected failure","Availability; Numerical methods; Outages; Random processes; Reliability; Reliability theory; Stochastic models; Stochastic systems; Analysis method; Closed-form expression; Developed model; Markov repairable systems; Reliability Index; Repairable systems; Steady-state availability; Time distribution; Reliability analysis","","","","","National Natural Science Foundation of China, NSFC, (71601010); China Postdoctoral Science Foundation, (2016M590030, 61573041, 71671009)","The research of Dr. Shijia Du is supported by National Natural Science Foundation of China (No. 71601010 ) and China Postdoctoral Science Foundation (No. 2016M590030 ). The research of Dr. Zhiguo Zeng is supported by National Natural Science Foundation of China ( 61573041 and 71671009 ). The research of Professor Rui Kang is supported by National Natural Science Foundation of China ( 61573041 ).","Z. Zeng; Chair System Science and the Energy Challenge, Fondation Electricité de France (EDF), CentraleSupélec, Université Paris-Saclay, Châtenay-Malabry, 92290, France; email: zhiguo.zeng@centralesupelec.fr","","Elsevier Ltd","","","","","","09518320","","RESSE","","English","Reliab Eng Syst Saf","Article","Final","All Open Access; Green Open Access","Scopus","2-s2.0-84997497801"
"ZIO E.; FAN M.; ZENG Z.; KANG R.","ZIO, Enrico (7005289082); FAN, Mengfei (57006024100); ZENG, Zhiguo (55348807500); KANG, Rui (57190489743)","7005289082; 57006024100; 55348807500; 57190489743","Application of reliability technologies in civil aviation: Lessons learnt and perspectives","2019","Chinese Journal of Aeronautics","32","1","","143","158","15","31","10.1016/j.cja.2018.05.014","https://www.scopus.com/inward/record.uri?eid=2-s2.0-85050465530&doi=10.1016%2fj.cja.2018.05.014&partnerID=40&md5=91a79510063063058b71425b70ef103d","Chair System Science and the Energy Challenge, Fondation Electricité de France (EDF), CentraleSupélec, Université Paris Saclay, Gif-sur-Yvette, 91190, France; Energy Department, Politecnico di Milano, Milan, 20156, Italy; Sino-French Risk Science and Engineering Lab, Beihang University, Beijing, 100083, China; School of Reliability and Systems Engineering, Beihang University, Beijing, 100083, China","ZIO E., Chair System Science and the Energy Challenge, Fondation Electricité de France (EDF), CentraleSupélec, Université Paris Saclay, Gif-sur-Yvette, 91190, France, Energy Department, Politecnico di Milano, Milan, 20156, Italy, Sino-French Risk Science and Engineering Lab, Beihang University, Beijing, 100083, China; FAN M., School of Reliability and Systems Engineering, Beihang University, Beijing, 100083, China; ZENG Z., Chair System Science and the Energy Challenge, Fondation Electricité de France (EDF), CentraleSupélec, Université Paris Saclay, Gif-sur-Yvette, 91190, France; KANG R., Sino-French Risk Science and Engineering Lab, Beihang University, Beijing, 100083, China","We consider reliability engineering in modern civil aviation industry, and the related engineering activities and methods. We consider reliability in a broad sense, referring to other system characteristics that are related to it, like availability, maintainability, safety and durability. We covered the entire lifecycle of the equipment, including reliability requirement identification, reliability analysis and design, verification and validation of reliability requirements (typically involved in the equipment design and development phase), quality assurance (which typically enters in the manufacturing phase), and fault diagnosis and prognosis and maintenance (which are connected to the operation phase). Lessons learnt from reliability engineering practices in civil aviation industry are given, which might serve as reference for reliability managers and engineers, also from other industries with high reliability requirements. © 2018 Chinese Society of Aeronautics and Astronautics","Civil aviation; Commercial aircraft; Fault diagnosis and prognosis; Human reliability analysis; Maintenance; Quality control; Reliability design; Reliability engineering","Civil aviation; Failure analysis; Fault detection; Maintenance; Quality control; Commercial aircraft; Diagnosis and prognosis; Human reliability analysis; Reliability design; Reliability engineering; Reliability analysis","","","","","National Natural Science Foundation of China, NSFC, (61573043, 71601010, 71671009)","This research is supported by the National Natural Science Foundation of China (Nos. 61573043 , 71671009 and 71601010 ). The authors would express their deepest gratitude to their numerous industrial partners from civil aviation industry who collaborated with the authors through consulting services or collaborative researches. The experience of collaborating with them greatly helps the authors to shape this paper.","Z. ZENG; Chair System Science and the Energy Challenge, Fondation Electricité de France (EDF), CentraleSupélec, Université Paris Saclay, Gif-sur-Yvette, 91190, France; email: zhiguo.zeng@centralesupelec.fr","","Chinese Journal of Aeronautics","","","","","","10009361","","CJAEE","","English","Chin J Aeronaut","Article","Final","All Open Access; Green Open Access; Hybrid Gold Open Access","Scopus","2-s2.0-85050465530"
"Hu Y.; Ding Y.; Zeng Z.","Hu, Yishuang (57201349413); Ding, Yi (35241887200); Zeng, Zhiguo (55348807500)","57201349413; 35241887200; 55348807500","Redundancy optimization for multi-state series-parallel systems using ordinal optimization-based-genetic algorithm","2022","Proceedings of the Institution of Mechanical Engineers, Part O: Journal of Risk and Reliability","236","1","","66","78","12","0","10.1177/1748006X211028699","https://www.scopus.com/inward/record.uri?eid=2-s2.0-85109900500&doi=10.1177%2f1748006X211028699&partnerID=40&md5=d901a3a75f199f879535a7b6e2568fb3","College of Electrical Engineering, Zhejiang University, Hangzhou, China; Chair on Risk and Resilience of Complex Systems, Laboratoire Génie Industriel, CentraleSupélec, Université Paris-Saclay, Gif-sur-Yvette, France","Hu Y., College of Electrical Engineering, Zhejiang University, Hangzhou, China; Ding Y., College of Electrical Engineering, Zhejiang University, Hangzhou, China; Zeng Z., Chair on Risk and Resilience of Complex Systems, Laboratoire Génie Industriel, CentraleSupélec, Université Paris-Saclay, Gif-sur-Yvette, France","Multi-state series-parallel systems (MSSPSs) are widely-used for representing engineering systems. In real-life cases, engineers need to design an optimal MSSPS structure by combining different versions and number of redundant components. The objective of the design is to ensure reliability requirements using the least costs, which could be formulated as a redundancy optimization problem under reliability constraints. The genetic algorithm is one of the most frequently used method for solving redundancy optimization problems. In traditional genetic algorithms, the population size needs to be determined based on the experience of the modeler. Often, this ends up creating a large number of unnecessary samples. As a result, the computational burden can be huge, especially for large-scale MSSPS structures. To solve these problems, this paper proposes an optimal structure designing method named as redundancy ordinal optimization. The universal generating function technique is applied to evaluate the reliabilities of the MSSPSs. Based on the reliabilities, an ordinal optimization algorithm is adapted to update the parent populations and the stopping criterion of genetic algorithm, so that the unnecessary structure designs can be eliminated. Numerical examples show that the proposed method improves the computational efficiency while remaining satisfactorily accurate. © IMechE 2021.","genetic algorithm; multi-state series-parallel systems; ordinal optimization; Redundancy optimization; reliability assessment","Computational efficiency; Numerical methods; Population statistics; Redundancy; Shape optimization; Structural optimization; Computational burden; Optimization problems; Ordinal optimization; Reliability constraints; Reliability requirements; Series-parallel system; Traditional genetic algorithms; Universal generating functions; Genetic algorithms","","","","","National Natural Science Foundation of China, NSFC, (71871200)","The author(s) disclosed receipt of the following financial support for the research, authorship, and/or publication of this article: This work was supported by the National Natural Science Foundation of China (Grant number 71871200). ","Y. Ding; College of Electrical Engineering, Zhejiang University, Hangzhou, China; email: yiding@zju.edu.cn","","SAGE Publications Ltd","","","","","","1748006X","","","","English","Proc. Inst. Mech. Eng. Part O J. Risk Reliab.","Article","Final","","Scopus","2-s2.0-85109900500"
