"Fan M.; Zeng Z.; Zio E.; Kang R.; Chen Y.","Fan, Mengfei (57006024100); Zeng, Zhiguo (55348807500); Zio, Enrico (7005289082); Kang, Rui (57190489743); Chen, Ying (35274478500)","57006024100; 55348807500; 7005289082; 57190489743; 35274478500","A stochastic hybrid systems model of common-cause failures of degrading components","2018","Reliability Engineering and System Safety","172","","","159","170","11","30","10.1016/j.ress.2017.12.003","https://www.scopus.com/inward/record.uri?eid=2-s2.0-85039741244&doi=10.1016%2fj.ress.2017.12.003&partnerID=40&md5=1d212c3c59990a451553bab15da67707","School of Reliability and Systems Engineering, Beihang University, Beijing, China; Chair System Science and the Energy Challenge, Fondation Electricité de France (EDF), CentraleSupélec, Université Paris Saclay, Gif-sur-Yvette, France; Energy Department, Politecnico di Milano, Milan, Italy","Fan M., School of Reliability and Systems Engineering, Beihang University, Beijing, China; Zeng Z., Chair System Science and the Energy Challenge, Fondation Electricité de France (EDF), CentraleSupélec, Université Paris Saclay, Gif-sur-Yvette, France; Zio E., Chair System Science and the Energy Challenge, Fondation Electricité de France (EDF), CentraleSupélec, Université Paris Saclay, Gif-sur-Yvette, France, Energy Department, Politecnico di Milano, Milan, Italy; Kang R., School of Reliability and Systems Engineering, Beihang University, Beijing, China; Chen Y., School of Reliability and Systems Engineering, Beihang University, Beijing, China","Common-Cause Failures (CCFs) are an important threat to safety critical systems. Most existing CCF models assume that the component failure behavior does not vary over time. Such an assumption is often challenged in practice due to the influence of various degradation mechanisms, e.g., wear, corrosion, fatigue, etc. In this paper, we develop a new model for CCFs considering components degradation. The model is developed in the mathematical framework of Stochastic Hybrid Systems (SHS). The CCFs are modeled as random shock processes that affect a group of components simultaneously and the components degradation processes are modeled by stochastic differential equations derived from physics-of-failures. The benefit of using the SHS model for CCFs is that the developed model is analytically solvable. The system reliability can, then, also be solved analytically in closed form. The proposed CCF modelling framework is demonstrated by a numerical example of a three-unit redundant system and, then, applied to an Auxiliary Feedwater Pump (AFP) system of a Nuclear Power Plant (NPP). A comparison to the Binomial Failure Rate (BFR) model of literature shows that by considering the components degradation processes, the proposed model can accurately describe the CCF effect on the reliability of a system with degrading components. © 2017 Elsevier Ltd","Binomial failure rate model; Common-cause failures; Component degradation; Monte Carlo simulation; Random shocks; Stochastic hybrid systems","Bins; Degradation; Differential equations; Failure analysis; Feedwater pumps; Hybrid systems; Intelligent systems; Monte Carlo methods; Nuclear fuels; Nuclear power plants; Outages; Reliability; Safety engineering; Solar buildings; Stochastic systems; Systems analysis; Common cause failure; Component degradation; Failure rate modeling; Random shocks; Stochastic hybrid systems; Stochastic models","","","","","National Natural Science Foundation of China, NSFC, (61573043, 71671009); China Scholarship Council, CSC, (201606020082)","This work has been performed within the initiative of the Center for Resilience and Safety of Critical Infrastructures (CRESCI, http://cresci.cn ). This research is supported by the National Natural Science Foundation of China (NSFC) under grand number 61573043 and 71671009 . The participation of Mengfei Fan to this research is supported by the China Scholarship Council (No. 201606020082 ).   ","Z. Zeng; Chair System Science and the Energy Challenge, Fondation Electricité de France (EDF), CentraleSupélec, Université Paris Saclay, Gif-sur-Yvette, France; email: zhiguo.zeng@centralesupelec.fr","","Elsevier Ltd","","","","","","09518320","","RESSE","","English","Reliab Eng Syst Saf","Article","Final","","Scopus","2-s2.0-85039741244"
"Bani-Mustafa T.; Zeng Z.; Zio E.; Vasseur D.","Bani-Mustafa, Tasneem (57201984857); Zeng, Zhiguo (55348807500); Zio, Enrico (7005289082); Vasseur, Dominique (55919360700)","57201984857; 55348807500; 7005289082; 55919360700","A new framework for multi-hazards risk aggregation","2020","Safety Science","121","","","283","302","19","12","10.1016/j.ssci.2019.08.043","https://www.scopus.com/inward/record.uri?eid=2-s2.0-85072530616&doi=10.1016%2fj.ssci.2019.08.043&partnerID=40&md5=94656b44adab93c11cd45b35f3226213","System Science and the Energetic Challenge, EDF Foundation, Laboratoire Genie Industriel, CentraleSupélec, Université Paris-Saclay, 3 Rue Joliot Curie, Gif-sur-Yvette, 91190, France; MINES ParisTech, PSL Research University, CRC, Sophia Antipolis, France; Energy Department, Politecnico di Milano, Via Giuseppe La Masa 34, Milan, 20156, Italy; Department of Nuclear Engineering, College of Engineering, Kyung Hee University, South Korea; EDF R&D, PERICLES (Performance et prévention des Risques Industriels du parc par la simulation et Les Etudes), EDF Lab Paris Saclay, 7 Bd Gaspard Monge, Palaiseau, 91120, France","Bani-Mustafa T., System Science and the Energetic Challenge, EDF Foundation, Laboratoire Genie Industriel, CentraleSupélec, Université Paris-Saclay, 3 Rue Joliot Curie, Gif-sur-Yvette, 91190, France; Zeng Z., System Science and the Energetic Challenge, EDF Foundation, Laboratoire Genie Industriel, CentraleSupélec, Université Paris-Saclay, 3 Rue Joliot Curie, Gif-sur-Yvette, 91190, France; Zio E., MINES ParisTech, PSL Research University, CRC, Sophia Antipolis, France, Energy Department, Politecnico di Milano, Via Giuseppe La Masa 34, Milan, 20156, Italy, Department of Nuclear Engineering, College of Engineering, Kyung Hee University, South Korea; Vasseur D., EDF R&D, PERICLES (Performance et prévention des Risques Industriels du parc par la simulation et Les Etudes), EDF Lab Paris Saclay, 7 Bd Gaspard Monge, Palaiseau, 91120, France","In this paper, we develop a new method for Multi-Hazards Risk Aggregation (MHRA). A hierarchical framework is first developed for evaluating the trustworthiness of the risk assessment. The evaluation is based on two main attributes (criteria), i.e., the strength of knowledge supporting the assessment and the fidelity of the risk assessment model. These two attributes are further broken down into sub-attributes and, finally, leaf attributes. The trustworthiness is calculated using a weighted average of the leaf attributes, in which the weights are calculated using the Dempster Shafer Theory-Analytical Hierarchy Process (DST-AHP). Risk aggregation is, then, performed by a “weighted posterior” method, considering the level of trustworthiness. An application to the risk aggregation of two hazard groups in Nuclear Power Plants (NPP) is illustrated. © 2019 Elsevier Ltd","Multi-hazards risk aggregation (MHRA); Nuclear power plants (NPP); Quantitative risk assessment (QRA); Risk-informed decision making; Strength of knowledge (SoK); Trustworthiness in risk assessment","Decision making; Hazards; Nuclear energy; Nuclear fuels; Nuclear power plants; Analytical Hierarchy Process; Dempster-Shafer theory; Quantitative risk assessment; Risk aggregations; Risk assessment models; Risk-informed decision making; Strength of knowledge (SoK); Weighted averages; article; decision making; nuclear power plant; plant leaf; risk assessment; Risk assessment","","","","","","","E. Zio; MINES ParisTech, PSL Research University, CRC, Sophia Antipolis, France; email: enrico.zio@polimi.it","","Elsevier B.V.","","","","","","09257535","","SSCIE","","English","Saf. Sci.","Article","Final","All Open Access; Bronze Open Access; Green Open Access","Scopus","2-s2.0-85072530616"
"Zeng Z.; Zio E.","Zeng, Zhiguo (55348807500); Zio, Enrico (7005289082)","55348807500; 7005289082","An integrated modeling framework for quantitative business continuity assessment","2017","Process Safety and Environmental Protection","106","","","76","88","12","40","10.1016/j.psep.2016.12.002","https://www.scopus.com/inward/record.uri?eid=2-s2.0-85009468540&doi=10.1016%2fj.psep.2016.12.002&partnerID=40&md5=9a13ae3fd808fcf69b8f2ab16ceb4296","Chair on System Science and the Energy Challenge, Fondation Electricite de France (EDF), CentraleSupélec, Université Paris-Saclay, Grande Voie des Vignes, Chatenay-Malabry, 92290, France; Energy Department, Politecnico di Milano, Milano, Italy","Zeng Z., Chair on System Science and the Energy Challenge, Fondation Electricite de France (EDF), CentraleSupélec, Université Paris-Saclay, Grande Voie des Vignes, Chatenay-Malabry, 92290, France; Zio E., Chair on System Science and the Energy Challenge, Fondation Electricite de France (EDF), CentraleSupélec, Université Paris-Saclay, Grande Voie des Vignes, Chatenay-Malabry, 92290, France, Energy Department, Politecnico di Milano, Milano, Italy","Systems are increasingly exposed to threats of disruptive events, e.g., failures, natural disasters, terrorist attacks, etc. A proactive approach is needed to protect the business and reduce the potential losses caused by these disruptive events. Business Continuity Management (BCM) is a way to integrate the recovery process within the preventive framework of risk assessment. Such integrated risk management strategy offers great potential benefits. However, the complexity of applying it in practice is such that existing BCM strategies are mainly based on qualitative methods only, which limits the potential added values. To support quantitative BCM, in this paper we define a set of quantitative business continuity metrics. The defined metrics are based on the estimated losses incurred by the disruptive event in the whole business process. For this, the business process is divided into four sequential phases, i.e., protection phase, mitigation phase, emergency phase and recovery phase. For each phase, a specific modeling method is developed and an integrated modeling framework is constructed for the business continuity. Simulation can, then, be used to quantify the business continuity metrics. The developed methods are applied to assess the business continuity of an oil storage tank farm. © 2016 Institution of Chemical Engineers","Business continuity management; Event consequence diagram; Event tree; Oil storage tank farm; Risk analysis; Semi-Markovian model","Disasters; Markov processes; Risk analysis; Risk management; Tanks (containers); Uncertainty analysis; Business continuity management; Event consequence diagram; Event trees; Oil storage tank; Semi-Markovian models; Risk assessment","","","","","","","E. Zio; Energy Department, Politecnico di Milano, Milano, Italy; email: enrico.zio@ecp.fr","","Institution of Chemical Engineers","","","","","","09575820","","","","English","Process Saf. Environ. Prot.","Article","Final","All Open Access; Green Open Access","Scopus","2-s2.0-85009468540"
"Belaid Y.N.; Fang Y.-P.; Zeng Z.; Legendre A.; Coudray P.; Barros A.","Belaid, Youba Nait (57224087723); Fang, Yi-Ping (55659850100); Zeng, Zhiguo (55348807500); Legendre, Anthony (57195685544); Coudray, Patrick (57224084974); Barros, Anne (7102745133)","57224087723; 55659850100; 55348807500; 57195685544; 57224084974; 7102745133","Resilience Optimization of Wide-Area Control in Smart Distribution Grids","2022","IFAC-PapersOnLine","55","16","","136","141","5","0","10.1016/j.ifacol.2022.09.013","https://www.scopus.com/inward/record.uri?eid=2-s2.0-85142234353&doi=10.1016%2fj.ifacol.2022.09.013&partnerID=40&md5=508732595f179d6832c158c1806cca8d","Electricité de France RandD, 7 Boulevard Gaspard Monge, Palaiseau, 91120, France; Risk and Resilience of Complex Systems, Laboratoire Génie Industriel, CentraleSupélec, Université Paris-Saclay, 3 Rue Joliot Curie, Gif-sur-Yvette, 91190, France","Belaid Y.N., Electricité de France RandD, 7 Boulevard Gaspard Monge, Palaiseau, 91120, France; Fang Y.-P., Risk and Resilience of Complex Systems, Laboratoire Génie Industriel, CentraleSupélec, Université Paris-Saclay, 3 Rue Joliot Curie, Gif-sur-Yvette, 91190, France; Zeng Z., Risk and Resilience of Complex Systems, Laboratoire Génie Industriel, CentraleSupélec, Université Paris-Saclay, 3 Rue Joliot Curie, Gif-sur-Yvette, 91190, France; Legendre A., Electricité de France RandD, 7 Boulevard Gaspard Monge, Palaiseau, 91120, France; Coudray P., Electricité de France RandD, 7 Boulevard Gaspard Monge, Palaiseau, 91120, France; Barros A., Risk and Resilience of Complex Systems, Laboratoire Génie Industriel, CentraleSupélec, Université Paris-Saclay, 3 Rue Joliot Curie, Gif-sur-Yvette, 91190, France","Large-scale power distribution networks rely on the wide-area control (WAC) function to conduct daily grid operations. Grid control is even more critical during extreme events as the WAC function is required to orchestrate the response to contingencies and enhance the power system resilience through failure localization, isolation, and service restoration. Both power and telecommunication domains are involved in control applications, giving rise to multiple cyber-physical interdependencies. This paper proposes a resilience-based optimization of the distribution service restoration (DSR) by coordinating strategies of crew dispatch and manual/remote switches operation. The telecommunication service and underlying infrastructure are identified as main enablers of the co-optimization as all considered resilience strategies communicate with the control center that collects crisis management information. Therefore, the availability of telecom points in terms of power supply is examined in this work. Failure propagation in the coupled power-telecom network is highlighted, and differences in failure propagation between overhead and underground power lines are explored. The proposed approach is formulated as a mixed-integer linear programming (MILP) model, evaluated under a multi-feeder interdependent power-telecom test network. Results show that combined scheduling of resilience strategies as well as prioritization of power supply to telecom points-of-interest, yield an enhanced recovery strategy.  Copyright © 2022 The Authors.","Distribution Service Restoration; Extreme Event; MILP; Resilience; Wide Area Control","Electric power system control; Electric power transmission networks; Integer programming; Outages; Wide area networks; Distribution service restorations; Extreme events; Integer Linear Programming; Mixed integer linear; Mixed-integer linear programming; Optimisations; Power; Resilience; Telecom; Wide area control; Restoration","","","","","SNCF; Orange; Electricité de France, EDF","This work is funded by EDF/Orange/SNCF in the framework of the Chair on Risk and Resilience of Complex Systems (CentraleSupleé c, EDF, Orange, SNCF).","Y.N. Belaid; Electricité de France RRandD, Palaiseau, 7 Boulevard Gaspard Monge, 91120, France; email: youba.nait-belaid@edf.fr; ; ","Tatiana F.","Elsevier B.V.","et al.; IFAC TC 1.2. Adaptive and Learning Systems; IFAC TC 1.5. Networked Systems; IFAC TC 2.1. Control Design; IFAC TC 2.2. Linear Control Systems; International Federation of Automatic Control (IFAC) - Technical Committee on Optimal Control, TC 2.4","18th IFAC Workshop on Control Applications of Optimization, CAO 2022","18 July 2022 through 22 July 2022","Gif sur Yvette","183672","24058963","","","","English","IFAC-PapersOnLine","Conference paper","Final","All Open Access; Bronze Open Access; Green Open Access","Scopus","2-s2.0-85142234353"
"Zhang Q.; Zeng Z.; Zio E.; Kang R.","Zhang, Qingyuan (57189631309); Zeng, Zhiguo (55348807500); Zio, Enrico (7005289082); Kang, Rui (57190489743)","57189631309; 55348807500; 7005289082; 57190489743","Probability box as a tool to model and control the effect of epistemic uncertainty in multiple dependent competing failure processes","2017","Applied Soft Computing Journal","56","","","570","579","9","33","10.1016/j.asoc.2016.06.016","https://www.scopus.com/inward/record.uri?eid=2-s2.0-84994226072&doi=10.1016%2fj.asoc.2016.06.016&partnerID=40&md5=39f53b01bd7a2d4a3534b4eecc84b036","School of Reliability and Systems Engineering, Beihang University, Beijing, China; Chair on Systems Science and Energetic Challenge, Fondation Electricité de France (EDF), CentraleSupelec, Universite’ Paris-Saclay, Chatenay-Malabry, France; Energy Department, Politecnico di Milano, Italy","Zhang Q., School of Reliability and Systems Engineering, Beihang University, Beijing, China; Zeng Z., Chair on Systems Science and Energetic Challenge, Fondation Electricité de France (EDF), CentraleSupelec, Universite’ Paris-Saclay, Chatenay-Malabry, France; Zio E., Chair on Systems Science and Energetic Challenge, Fondation Electricité de France (EDF), CentraleSupelec, Universite’ Paris-Saclay, Chatenay-Malabry, France, Energy Department, Politecnico di Milano, Italy; Kang R., School of Reliability and Systems Engineering, Beihang University, Beijing, China","Engineering components and systems are often subject to multiple dependent competing failure processes (MDCFPs). MDCFPs have been well studied in literature and various models have been developed to predict the reliability of MDCFPs. In practice, however, due to the limited resource, it is often hard to estimate the precise values of the parameters in the MDCFP model. Hence, the predicted reliability is affected by epistemic uncertainty. Probability box (P-box) is applied in this paper to describe the effect of epistemic uncertainty on MDCFP models. A dimension-reduced sequential quadratic programming (DRSQP) method is developed for the construction of P-box. A comparison to the conventional construction method shows that DRSQP method reduces the computational costs required for P-box constructions. Since epistemic uncertainty reflects the unsureness in the predicted reliability, a decision maker might want to reduce it by investing resource to more accurately estimate the value of each model parameter. A two-stage optimization framework is developed to allocate the resource among the parameters and ensure that epistemic uncertainty is reduced in a most efficient way. Finally, the developed methods are applied on a real case study, a spool valve, to demonstrate their validity. © 2016 Elsevier B.V.","Epistemic uncertainty; Multiple dependent competing failure process; Reliability box; Reliability modeling; SQP method","Decision making; Quadratic programming; Reliability; Competing failure; Conventional constructions; Engineering components; Epistemic uncertainties; Reduced sequential quadratic programming; Reliability model; SQP method; Two stage optimizations; Uncertainty analysis","","","","","National Natural Science Foundation of China, (61573043)","This work has been performed within the initiative of the Center for Resilience and Safety of Critical Infrastructures (CRESCI, http://cresci.cn). This work is supported by Natural Science Foundation of China (NSFC) under contract No. 61573043.","Z. Zeng; Chair on Systems Science and Energetic Challenge, Fondation Electricité de France (EDF), CentraleSupelec, Universite’ Paris-Saclay, France; email: zhiguo.zeng@centralesupelec.fr","","Elsevier Ltd","","","","","","15684946","","","","English","Appl. Soft Comput. J.","Article","Final","All Open Access; Green Open Access","Scopus","2-s2.0-84994226072"
"Zeng Z.; Zio E.","Zeng, Zhiguo (55348807500); Zio, Enrico (7005289082)","55348807500; 7005289082","Joint Optimization of Business Continuity by Designing Safety Barriers for Accident Prevention, Mitigation and Emergency Responses","2019","Proceedings - 2018 3rd International Conference on System Reliability and Safety, ICSRS 2018","","","8688845","316","320","4","1","10.1109/ICSRS.2018.8688845","https://www.scopus.com/inward/record.uri?eid=2-s2.0-85065030373&doi=10.1109%2fICSRS.2018.8688845&partnerID=40&md5=08338b0dccc3009fc6742212c2cbb1de","Fondation Électricité de France (EDF), CeruraleSupélec, Université Paris-Saclay, Chair on System Science and the Energy Challenge, 3 Rue Joliot Curie, Gif-sur-Yvette, 91190, France; Politecnico di Milano, Energy Department, Milano, 20133, Italy","Zeng Z., Fondation Électricité de France (EDF), CeruraleSupélec, Université Paris-Saclay, Chair on System Science and the Energy Challenge, 3 Rue Joliot Curie, Gif-sur-Yvette, 91190, France; Zio E., Politecnico di Milano, Energy Department, Milano, 20133, Italy","In this paper, an optimization model is developed for optimal design of the safety barriers in a nuclear power plant. By applying the developed model, safety barriers of different natures, i.e., the prevention, mitigation, emergency and recovery measures, can be optimized jointly for business continuity. A hierarchical numerical optimization method based on golden search and genetic algorithm is developed to obtain the optimal solutions. A numerical case study regarding the allocation of resources among the safety barriers prevention, mitigation and emergency in a nuclear power plant is worked out to maximize business continuity against the threat of steam generator tube ruptures. © 2018 IEEE.","business continuity; condition-based maintenance; event tree; nuclear power plant; optimization; redundancy allocation; Safety barrier; steam generator tube rupture","Genetic algorithms; Nuclear energy; Nuclear fuels; Nuclear power plants; Nuclear reactor accidents; Numerical methods; Optimal systems; Optimization; Reliability; Steam power plants; Tubes (components); Business continuity; Condition based maintenance; Event trees; Redundancy allocation; Safety barriers; Steam generator tube ruptures; Steam generators","","","","","","","","","Institute of Electrical and Electronics Engineers Inc.","","3rd International Conference on System Reliability and Safety, ICSRS 2018","24 November 2018 through 26 November 2018","Barcelona","147450","","978-172810238-2","","","English","Proc. - Int. Conf. Syst. Reliab. Saf., ICSRS","Conference paper","Final","All Open Access; Green Open Access","Scopus","2-s2.0-85065030373"
