"Bellè A.; Abdin A.F.; Fang Y.-P.; Zeng Z.; Barros A.","Bellè, Andrea (57286978200); Abdin, Adam F. (57224782100); Fang, Yi-Ping (55659850100); Zeng, Zhiguo (55348807500); Barros, Anne (7102745133)","57286978200; 57224782100; 55659850100; 55348807500; 7102745133","A data-driven distributionally robust approach for the optimal coupling of interdependent critical infrastructures under random failures","2023","European Journal of Operational Research","309","2","","872","889","17","1","10.1016/j.ejor.2023.01.060","https://www.scopus.com/inward/record.uri?eid=2-s2.0-85147705423&doi=10.1016%2fj.ejor.2023.01.060&partnerID=40&md5=26210a212e4673944c61053410e5624f","Thales Research & Technology, Palaiseau, France; Chair on Risk and Resilience of Complex Systems, Laboratoire Génie Industriel, CentraleSupélec, Université Paris-Saclay, 3 Rue Joliot Curie, Gif-sur-Yvette, 91190, France; Laboratoire Génie Industriel, CentraleSupélec, Université Paris-Saclay, 3 Rue Joliot Curie, Gif-sur-Yvette, 91190, France","Bellè A., Thales Research & Technology, Palaiseau, France, Chair on Risk and Resilience of Complex Systems, Laboratoire Génie Industriel, CentraleSupélec, Université Paris-Saclay, 3 Rue Joliot Curie, Gif-sur-Yvette, 91190, France; Abdin A.F., Laboratoire Génie Industriel, CentraleSupélec, Université Paris-Saclay, 3 Rue Joliot Curie, Gif-sur-Yvette, 91190, France; Fang Y.-P., Chair on Risk and Resilience of Complex Systems, Laboratoire Génie Industriel, CentraleSupélec, Université Paris-Saclay, 3 Rue Joliot Curie, Gif-sur-Yvette, 91190, France; Zeng Z., Chair on Risk and Resilience of Complex Systems, Laboratoire Génie Industriel, CentraleSupélec, Université Paris-Saclay, 3 Rue Joliot Curie, Gif-sur-Yvette, 91190, France; Barros A., Chair on Risk and Resilience of Complex Systems, Laboratoire Génie Industriel, CentraleSupélec, Université Paris-Saclay, 3 Rue Joliot Curie, Gif-sur-Yvette, 91190, France","Critical infrastructures (CIs), such as energy systems, transportation networks and telecommunications networks, are the backbone of any advanced society, and ensuring their resilience is a fundamental task. CIs are often interconnected to, and interdependent on, each other through complex coupling interfaces. Failures can propagate among different CIs through these coupling interfaces, causing multi-sectoral disruption. The design of the coupling interface can strongly impact the cascading effect between different CIs. In this paper, we propose a data-driven distributionally robust approach for the optimal coupling of interdependent CIs. Our model obtains an optimal coupling interface that maximizes the expected combined performance of interdependent CIs under random failure scenarios with ambiguous probability distributions. We demonstrate the validity of the proposed approach using an ambiguity set built upon a synthetic data set of historical contingency scenarios. Interdependent power and gas networks (IPGNs) are used as an illustrative case study. We show that our proposed approach leads to better coupling interfaces with higher expected performance under disruptive scenarios. © 2023 Elsevier B.V.","Coupling interface; Distributionally robust optimization; Interdependent critical infrastructures; Random failures; Risk analysis","Critical infrastructures; Failure (mechanical); Optimization; Probability distributions; Public works; Risk assessment; Coupling interfaces; Data driven; Distributionally robust optimization; Energy systems; Interdependent critical infrastructure; Performance; Random failures; Robust approaches; Robust optimization; Transportation network; Risk analysis","","","","","","","A. Bellè; Thales Research & Technology, Palaiseau, France; email: andrea.belle@thalesgroup.com","","Elsevier B.V.","","","","","","03772217","","EJORD","","English","Eur J Oper Res","Article","Final","","Scopus","2-s2.0-85147705423"
"Xing J.; Zeng Z.; Zio E.","Xing, Jinduo (57193733355); Zeng, Zhiguo (55348807500); Zio, Enrico (7005289082)","57193733355; 55348807500; 7005289082","A framework for dynamic risk assessment with condition monitoring data and inspection data","2019","Reliability Engineering and System Safety","191","","106552","","","","28","10.1016/j.ress.2019.106552","https://www.scopus.com/inward/record.uri?eid=2-s2.0-85070696503&doi=10.1016%2fj.ress.2019.106552&partnerID=40&md5=331fc3e46df04eabe76bae7bb9ce330b","Chair System Science and the Energy Challenge, Fondation Electricité de France (EDF), CentraleSupélec, Université Paris Saclay, Gif-sur-Yvette, France; Energy Department, Politecnico di Milano, Milan, Italy; Department of Nuclear Engineering, College of Engineering, Kyung Hee University, South Korea","Xing J., Chair System Science and the Energy Challenge, Fondation Electricité de France (EDF), CentraleSupélec, Université Paris Saclay, Gif-sur-Yvette, France; Zeng Z., Chair System Science and the Energy Challenge, Fondation Electricité de France (EDF), CentraleSupélec, Université Paris Saclay, Gif-sur-Yvette, France; Zio E., Chair System Science and the Energy Challenge, Fondation Electricité de France (EDF), CentraleSupélec, Université Paris Saclay, Gif-sur-Yvette, France, Energy Department, Politecnico di Milano, Milan, Italy, Department of Nuclear Engineering, College of Engineering, Kyung Hee University, South Korea","In this paper, a framework is proposed for integrating condition monitoring and inspection data in Dynamic risk assessment (DRA). Condition monitoring data are online-collected by sensors and indirectly relate to component degradation; inspection data are recorded in physical inspections that directly measure the component degradation. A Hidden Markov Gaussian Mixture Model (HM-GMM) is developed for modeling the condition monitoring data and a Bayesian network (BN) is developed to integrate the two data sources for DRA. Risk updating and prediction are exemplified on an Event Tree (ET) risk assessment model. A numerical case study and a real-world application on a Nuclear Power Plant (NPP) are performed to demonstrate the application of the proposed framework. © 2019 Elsevier Ltd","Bayesian network (BN); Condition monitoring data; Dynamic risk assessment (DRA); Event tree (ET); Hidden Markov Gaussian Mixture Model (HM-GMM); Inspection data; Nuclear power plant (NPP); Probabilistic risk assessment (PRA); Prognostic and health management (PHM)","Bayesian networks; Condition monitoring; Gaussian distribution; Health risks; Information management; Inspection; Knowledge based systems; Nuclear energy; Nuclear fuels; Nuclear power plants; Trees (mathematics); Condition-monitoring data; Dynamic risk assessments; Event trees; Gaussian Mixture Model; Inspection datum; Probabilistic Risk Assessment; Prognostic and health management; Risk assessment","","","","","","","Z. Zeng; Chair System Science and the Energy Challenge, Fondation Electricité de France (EDF), CentraleSupélec, Université Paris Saclay, France; email: zhiguo.zeng@centralesupelec.fr","","Elsevier Ltd","","","","","","09518320","","RESSE","","English","Reliab Eng Syst Saf","Article","Final","All Open Access; Bronze Open Access; Green Open Access","Scopus","2-s2.0-85070696503"
"Xiahou T.; Zeng Z.; Liu Y.; Huang H.-Z.","Xiahou, Tangfan (57202959803); Zeng, Zhiguo (55348807500); Liu, Yu (57116628700); Huang, Hong-Zhong (9744861000)","57202959803; 55348807500; 57116628700; 9744861000","Fusing Conflicting Multisource Imprecise Information for Reliability Assessment of Multistate Systems: A Two-Stage Optimization Approach","2023","IEEE Transactions on Reliability","72","1","","90","105","15","4","10.1109/TR.2022.3187075","https://www.scopus.com/inward/record.uri?eid=2-s2.0-85135760993&doi=10.1109%2fTR.2022.3187075&partnerID=40&md5=12ced092e3264395ec80de95ff428a5b","University of Electronic Science and Technology of China, School of Mechanical and Electrical Engineering, Chengdu, 611731, China; Université Paris Saclay, Chaire on Risk and Resilience of Complex Systems, CentraleSupélec, Laboratoire Genie Industriel, Gif-sur-Yvette, 91190, France; University of Electronic Science and Technology of China, Center for System Reliability and Safety, Chengdu, 611731, China","Xiahou T., University of Electronic Science and Technology of China, School of Mechanical and Electrical Engineering, Chengdu, 611731, China; Zeng Z., Université Paris Saclay, Chaire on Risk and Resilience of Complex Systems, CentraleSupélec, Laboratoire Genie Industriel, Gif-sur-Yvette, 91190, France; Liu Y., University of Electronic Science and Technology of China, School of Mechanical and Electrical Engineering, Chengdu, 611731, China, University of Electronic Science and Technology of China, Center for System Reliability and Safety, Chengdu, 611731, China; Huang H.-Z., University of Electronic Science and Technology of China, School of Mechanical and Electrical Engineering, Chengdu, 611731, China, University of Electronic Science and Technology of China, Center for System Reliability and Safety, Chengdu, 611731, China","Expert knowledge is an important information source for system reliability assessment, especially when historical data are limited. However, when elicited, expert knowledge is often imprecise with large uncertainty. Moreover, as experts usually own different expertise and knowledge, the elicited knowledge from different experts might be conflicting. In this article, a two-stage optimization model is put forth to fuse the imprecise and conflicting information from multiple sources to assess reliability of multistate systems. The degradation of the components in the multistate system is modeled via imprecise Markov models. Then, in the first-stage optimization, upper and lower bounds of the degradation model parameters are determined by minimizing the conflict between the prediction of the model and the multisource imprecise information elicited from experts. A particle swarm optimization algorithm is tailored to solve the computational problems brought by the presence of high-dimensional decision variables and resolve the optimization problem. The second-stage optimization is, then, conducted to identify the upper and lower bounds of the system reliability function given that the degradation model parameters are constrained in the bounds obtained from the first-stage optimization. A numerical example, along with a radar display and control system, is used to demonstrate the effectiveness and applicability of the proposed method.  © 1963-2012 IEEE.","Multisource imprecise information; multistate system (MSS); reliability assessment; two-stage optimization","Constrained optimization; Markov processes; Numerical methods; Particle swarm optimization (PSO); Radar displays; Bayes method; Imprecise information; Multi-Sources; Multi-state system; Multisource imprecise information; Multistate system; Optimisations; Reliability assessments; Two stage optimizations; Uncertainty; Upper Bound; Reliability analysis","","","","","National Natural Science Foundation of China, NSFC, (71771039, 71922006)","This work was support by the National Natural Science Foundation of China under Grant 71922006 and Grant 71771039.","Y. Liu; University of Electronic Science and Technology of China, School of Mechanical and Electrical Engineering, Chengdu, 611731, China; email: yuliu@uestc.edu.cn","","Institute of Electrical and Electronics Engineers Inc.","","","","","","00189529","","IEERA","","English","IEEE Trans Reliab","Article","Final","","Scopus","2-s2.0-85135760993"
"Bellè A.; Zeng Z.; Duval C.; Sango M.; Barros A.","Bellè, Andrea (57286978200); Zeng, Zhiguo (55348807500); Duval, Carole (25645587200); Sango, Marc (55353671400); Barros, Anne (7102745133)","57286978200; 55348807500; 25645587200; 55353671400; 7102745133","Modeling and vulnerability analysis of interdependent railway and power networks: Application to British test systems","2022","Reliability Engineering and System Safety","217","","108091","","","","28","10.1016/j.ress.2021.108091","https://www.scopus.com/inward/record.uri?eid=2-s2.0-85116573986&doi=10.1016%2fj.ress.2021.108091&partnerID=40&md5=6fada2d6d6dd5a5f212a69e0325967b7","Chair on Risk and Resilience of Complex Systems, Laboratoire Génie Industriel, CentraleSupélec, Université Paris-Saclay, France; Électricité de France (EDF) R&D Palaiseau, France; SNCF, Direction Technologies Innovation et Projet Groupe, Innovation & Recherche, Département Physique du Système Ferroviaire, Equipe Sécurité Système, France","Bellè A., Chair on Risk and Resilience of Complex Systems, Laboratoire Génie Industriel, CentraleSupélec, Université Paris-Saclay, France; Zeng Z., Chair on Risk and Resilience of Complex Systems, Laboratoire Génie Industriel, CentraleSupélec, Université Paris-Saclay, France; Duval C., Électricité de France (EDF) R&D Palaiseau, France; Sango M., SNCF, Direction Technologies Innovation et Projet Groupe, Innovation & Recherche, Département Physique du Système Ferroviaire, Equipe Sécurité Système, France; Barros A., Chair on Risk and Resilience of Complex Systems, Laboratoire Génie Industriel, CentraleSupélec, Université Paris-Saclay, France","Railway and power networks are among the most important critical infrastructures and their vulnerability under different types of disrupting events has been analyzed extensively. However, the increasing degree of interconnection between these two critical infrastructures makes it necessary to consider the multiple interdependencies when conducting vulnerability assessments. We propose an approach for the modeling and vulnerability analysis of interdependent railway and power networks which accounts for a realistic coupling through the traction power network, which acts as an interface. Moreover, we consider cascading failures within and between networks. With the proposed model, we show that failures in the power network have a considerable negative impact on the railway network. In addition, our analysis shows that the dependency of the railway network on the power network can considerably impact vulnerability and cascading failures dynamics of the power network. © 2021 Elsevier Ltd","Cascading failures; Critical infrastructures; Interdependent networks; Power network; Railway network; Vulnerability","Electric network analysis; Electric power transmission networks; Network security; Public works; Railroads; Uncertainty analysis; Cascading failures; Interdependent network; Modeling analyzes; Network applications; Power networks; Railway network; Test systems; Vulnerability; Vulnerability analysis; Vulnerability assessments; Critical infrastructures","","","","","","","A. Bellè; Chair on Risk and Resilience of Complex Systems, Laboratoire Génie Industriel, CentraleSupélec, Université Paris-Saclay, France; email: andrea.belle@centralesupelec.fr","","Elsevier Ltd","","","","","","09518320","","RESSE","","English","Reliab Eng Syst Saf","Article","Final","","Scopus","2-s2.0-85116573986"
"Hu Y.; Lin Y.; Ding Y.; Chen X.; Zeng Z.","Hu, Yishuang (57201349413); Lin, Yu (57207942029); Ding, Yi (35241887200); Chen, Xingying (23476842600); Zeng, Zhiguo (55348807500)","57201349413; 57207942029; 35241887200; 23476842600; 55348807500","Screening of optimal structure among large-scale multi-state weighted k-out-of-n systems considering reliability evaluation","2021","Reliability Engineering and System Safety","206","","107268","","","","4","10.1016/j.ress.2020.107268","https://www.scopus.com/inward/record.uri?eid=2-s2.0-85094325012&doi=10.1016%2fj.ress.2020.107268&partnerID=40&md5=047fc4fdae633be16c244278db169213","College of Electrical Engineering, Zhejiang University, Hangzhou, China; College of Energy and Electrical Engineering, Hohai University, Nanjing, China; Chair on Risk and Resilience of Complex Systems, Laboratoie Genie Industriel, CentraleSupélec, Université Paris-Saclay, Gif-sur-Yvette, France","Hu Y., College of Electrical Engineering, Zhejiang University, Hangzhou, China; Lin Y., College of Electrical Engineering, Zhejiang University, Hangzhou, China; Ding Y., College of Electrical Engineering, Zhejiang University, Hangzhou, China; Chen X., College of Energy and Electrical Engineering, Hohai University, Nanjing, China; Zeng Z., Chair on Risk and Resilience of Complex Systems, Laboratoie Genie Industriel, CentraleSupélec, Université Paris-Saclay, Gif-sur-Yvette, France","Keen interest in the development of multi-state weighted k-out-of-n systems (MSWKNS) has been currently observed. In real-life cases, considering that multiple different MSWKNS structures are provided beforehand, system designers need to select an optimal one among numbers of different structure designs. Thus, screening of the optimal MSWKNS structure is meaningful and critical. Moreover, the system reliability becomes an increasingly important factor that should be assessed in structure screening. However, when facing a large-scale MSWKNS whose number of states is enormous, exact reliability evaluation can be rather complicated. Meanwhile, due to the large number of system structure designs, the computational burden of screening can be very huge. To effectively select the optimal structure among enormous MSWKNSs under reliability constraint, an optimal structure screening method named as ordinal structure screening (OSS) is proposed. Ordinal optimization (OO) algorithm is adopted with a novel utilization of continuization discretization approximation (CDA) method. To shorten the reliability evaluation time, CDA is employed to approximate reliabilities. Based on the approximate reliabilities, OO is applied to reduce the number of system structures to be evaluated, which accelerates the screening process. Illustrative results show that the proposed method appeals in improving computational efficiency with satisfactory accuracy performance. © 2020","continuization; Discretization approximation; Multi-state weighted k-out-of-n system; Ordinal Optimization; Structure screening","Approximation algorithms; Computational efficiency; Reliability; Scales (weighing instruments); Structured programming; Computational burden; Different structure; Optimal structures; Ordinal optimization; Reliability constraints; Reliability Evaluation; System reliability; Weighted k-out-of-n system; Structural optimization","","","","","National Natural Science Foundation of China, NSFC, (51537010, 71871200)","This work was supported partly by the National Natural Science Foundation of China (Grant #71871200 and #51537010 ). ","Y. Ding; College of Electrical Engineering, Zhejiang University, Hangzhou, China; email: yiding@zju.edu.cn","","Elsevier Ltd","","","","","","09518320","","RESSE","","English","Reliab Eng Syst Saf","Article","Final","All Open Access; Green Open Access","Scopus","2-s2.0-85094325012"
"Fan M.; Zeng Z.; Zio E.; Kang R.; Chen Y.","Fan, Mengfei (57006024100); Zeng, Zhiguo (55348807500); Zio, Enrico (7005289082); Kang, Rui (57190489743); Chen, Ying (35274478500)","57006024100; 55348807500; 7005289082; 57190489743; 35274478500","A Sequential Bayesian Approach for Remaining Useful Life Prediction of Dependent Competing Failure Processes","2019","IEEE Transactions on Reliability","68","1","8531775","317","329","12","32","10.1109/TR.2018.2874459","https://www.scopus.com/inward/record.uri?eid=2-s2.0-85056303883&doi=10.1109%2fTR.2018.2874459&partnerID=40&md5=187bf37dc76f05fc0ca5606fcd6213f5","School of Reliability and Systems Engineering, Beihang University, Beijing, 100083, China; Department on System Science and the Energy Challenge, Fondation Electricite de France, Laboratoire Genie Industriel, CentraleSupelec, Universite Paris-Saclay, Gif-sur-Yvette, 4103, France; Energy Department, Politecnico di Milano, Milano, 20133, Italy","Fan M., School of Reliability and Systems Engineering, Beihang University, Beijing, 100083, China; Zeng Z., Department on System Science and the Energy Challenge, Fondation Electricite de France, Laboratoire Genie Industriel, CentraleSupelec, Universite Paris-Saclay, Gif-sur-Yvette, 4103, France; Zio E., Department on System Science and the Energy Challenge, Fondation Electricite de France, Laboratoire Genie Industriel, CentraleSupelec, Universite Paris-Saclay, Gif-sur-Yvette, 4103, France, Energy Department, Politecnico di Milano, Milano, 20133, Italy; Kang R., School of Reliability and Systems Engineering, Beihang University, Beijing, 100083, China; Chen Y., School of Reliability and Systems Engineering, Beihang University, Beijing, 100083, China","A sequential Bayesian approach is presented for remaining useful life (RUL) prediction of dependent competing failure processes (DCFP). The DCFP considered comprises of soft failure processes due to degradation and hard failure processes due to random shocks, where dependency arises due to the abrupt changes to the degradation processes brought by the random shocks. In practice, random shock processes are often unobservable, which makes it difficult to accurately estimate the shock intensities and predict the RUL. In the proposed method, the problem is solved recursively in a two-stage framework: in the first stage, parameters related to the degradation processes are updated using particle filtering, based on the degradation data observed through condition monitoring; in the second stage, the intensities of the random shock processes are updated using the Metropolis-Hastings algorithm, considering the dependency between the degradation and shock processes, and the fact that no hard failure has occurred. The updated parameters are, then, used to predict the RUL of the system. Two numerical examples are considered for demonstration purposes and a real dataset from milling machines is used for application purposes. Results show that the proposed method can be used to accurately predict the RUL in DCFP conditions. © 2018 IEEE.","Degradation; dependent competing failure processes; Markov chain Monte Carlo; particle filtering; prognostics; random shocks; remaining useful life","Bayesian networks; Condition monitoring; Data structures; Degradation; Fans; Forecasting; Markov processes; Reliability; Bayes method; Competing failure; Electric shock; Markov Chain Monte-Carlo; Particle Filtering; Predictive models; prognostics; Random shocks; Remaining useful lives; Monte Carlo methods","","","","","National Natural Science Foundation of China, NSFC, (61573043, 71601010, 71671009); China Scholarship Council, CSC, (201606020082)","This work was supported in part by the National Natural Science Foundation of China under Grant 61573043, Grant 71671009, and Grant 71601010, and in part by the China Scholarship Council (201606020082).","Z. Zeng; Department on System Science and the Energy Challenge, Fondation Electricite de France, Laboratoire Genie Industriel, CentraleSupelec, Universite Paris-Saclay, Gif-sur-Yvette, 4103, France; email: zhiguo.zeng@centralesupelec.fr","","Institute of Electrical and Electronics Engineers Inc.","","","","","","00189529","","IEERA","","English","IEEE Trans Reliab","Article","Final","All Open Access; Green Open Access","Scopus","2-s2.0-85056303883"
