"Breda P.; Markova R.; Abdin A.F.; Mantı N.P.; Carlo A.; Jha D.","Breda, Paola (57209582525); Markova, Rada (58531024500); Abdin, Adam F. (57224782100); Mantı, Nebile Pelin (57222004188); Carlo, Antonio (57208624091); Jha, Devanshu (57219760916)","57209582525; 58531024500; 57224782100; 57222004188; 57208624091; 57219760916","An extended review on cyber vulnerabilities of AI technologies in space applications: Technological challenges and international governance of AI","2023","Journal of Space Safety Engineering","","","","","","","0","10.1016/j.jsse.2023.08.003","https://www.scopus.com/inward/record.uri?eid=2-s2.0-85168485820&doi=10.1016%2fj.jsse.2023.08.003&partnerID=40&md5=3a391604ba4ee20152052e31871216fc","International Space University, Illkirch-Graffenstaden, France; Space Generation Advisory Council (SGAC), Vienna, Austria; CentraleSupélec, Laboratoire Génie Industriel, Université Paris-Saclay, Gif-sur-Yvette, 91190, France; PIL Department, Faculty of Law, Istanbul University, Istanbul, Turkey; Tallinn University of Technology, Tallinn, Estonia","Breda P., International Space University, Illkirch-Graffenstaden, France; Markova R., Space Generation Advisory Council (SGAC), Vienna, Austria; Abdin A.F., CentraleSupélec, Laboratoire Génie Industriel, Université Paris-Saclay, Gif-sur-Yvette, 91190, France; Mantı N.P., PIL Department, Faculty of Law, Istanbul University, Istanbul, Turkey; Carlo A., Tallinn University of Technology, Tallinn, Estonia; Jha D., Space Generation Advisory Council (SGAC), Vienna, Austria","The aerospace community and industry have recently shown increasing interest towards the use of Artificial Intelligence (AI) for space applications, partially driven by the recent development of the NewSpace economy. AI has already come into extensive use in spacecraft operations, for example to support efficient operations of satellite constellations and system health management. However, since most critical infrastructures rely on space systems, the use of new technologies, such as AI algorithms or increased system autonomy on-board, introduces further vulnerabilities on the system level. As a matter of fact, AI cyber security is becoming an important aspect to ensure space safety and operational security. Apart from identifying new vulnerabilities that AI systems may introduce to space assets, this paper seeks for safety guidelines and technical standardisations developed for terrestrial applications that can be applicable to AI systems in space. Existing policy guidance for cybersecurity and AI, especially for the European context, is discussed. To promote the safe use of AI technologies in space this work underlines the urgency for policymakers, governance, and technical institutions to initiate or further support the development of a suitable framework to address the new cyber-vulnerabilities introduced by AI technologies when applied to space systems. The paper suggests a regulatory approach based on technical standardisation in the field of AI, which is built upon a multidisciplinary research of AI applications in non-space sectors where the level of autonomy is more advanced. © 2023 International Association for the Advancement of Space Safety","Artificial intelligence; Cyber-vulnerabilities; Safety policy; Space applications; Technical standards","","","","","","","","P. Breda; International Space University, Illkirch-Graffenstaden, France; email: paola.breda@community.isunet.edu","","Elsevier Ltd","","","","","","24688975","","","","English","J. Space Saf.  Eng.","Article","Article in press","","Scopus","2-s2.0-85168485820"
"Breda P.; Caayon A.K.; Vadas A.; Abdin A.F.","Breda, Paola (57209582525); Caayon, Arthur Kho (58531872000); Vadas, Avin (58530827800); Abdin, Adam F. (57224782100)","57209582525; 58531872000; 58530827800; 57224782100","North Star: Data-Driven Sailing for an Efficient and Safe Passage in the Arctic Ocean","2022","Proceedings of the International Astronautical Congress, IAC","2022-September","","","","","","0","","https://www.scopus.com/inward/record.uri?eid=2-s2.0-85167574421&partnerID=40&md5=2949d9315a341be8aad3210630dcfcd7","HyImpulse Technologies GmbH, Neuenstadt am Kocher, Germany; Movial, Helsinki, Finland; Freelancer Product Designer, Lisbon, Portugal; Université Paris-Saclay, CentraleSupélec, Laboratoire Génie Industriel, Gif-sur-Yvette, 91190, France","Breda P., HyImpulse Technologies GmbH, Neuenstadt am Kocher, Germany; Caayon A.K., Movial, Helsinki, Finland; Vadas A., Freelancer Product Designer, Lisbon, Portugal; Abdin A.F., Université Paris-Saclay, CentraleSupélec, Laboratoire Génie Industriel, Gif-sur-Yvette, 91190, France","Maritime navigation in the Arctic Ocean is fraught with danger such as strong atmospheric electromagnetic interference, adverse weather conditions, unreliable satellite signal and coverage. A vessel not knowing its position while navigating in the Arctic may find itself in a critical situation. In the framework of the 2nd CASSINI Hackathon aimed to promote ideas based on safe passage in the Arctic, the authors developed a product called North Star. The aim of North Star is using Earth Observation data provided by Galileo and Copernicus services to improve navigation in the Arctic. It consists of an on-board neural engine, the AI Pilot, which searches for and identifies a safe route for the user. The neural engine can be trained on the Copernicus data from the Sentinel constellation, which includes information such as ice thickness, iceberg distribution, wind speed direction, and wave height for a specific passage. In the event of a satellite signal loss, the AI Pilot reuses the information received from Galileo up to that point and integrates them with the vessel's own maritime sensors to maintain the viability of the projected route. The idea behind the AI Pilot is that when a vessel is within communication range with other North Star vessels, they form an ad-hoc mesh network of data collectors with edge computing capabilities. The creation of a mesh network can provide augmented data to the entire GNSS ecosystem. While shipping transportation of oil and gas across the Arctic passages undergoes more strict regulations, private tourism and charter yacht operators in the Arctic are an emerging market due to the relatively unsafe travel conditions. North Star can have a beneficial impact on the tourist sector in the first place, extending afterwards to support Search and Rescue operations, as well as contributing to the protection of the environment and the Arctic fauna. This research presents the concept of operations of North Star, as well as its high-level description from the technical perspective. The potential of this business case is further investigated, to include a roadmap of services offered until the return of investment, potential customers, and current competitors. Copyright © IAC 2022 by the authors. Published by the IAF, with permission and released to the IAF to publish in all forms.","Arctic Ocean; Artificial Intelligence; Copernicus Services; Maritime Navigation; Sensor Fusion; Tourism","Engines; Sea ice; Stars; Wind; Adverse weather; Arctic ocean; Condition; Copernicu service; Data driven; GALILEO; Maritime navigation; Satellite signals; Sensor fusion; Stars: Be; Mesh generation","","","","","European Commission, EC","Copernicus data are accessed via Data and Information Access Services (DIAS), cloud-based platforms funded by the European Commission. The DIAS selected for North Star is WEkEO which contains environmental data, virtual processing environments and user support [20]. Note that WEkEO is only one possibility of five DIAS to access Copernicus data. All DIAS provide access to Copernicus Sentinel data as well as to the six operational services of Copernicus covering the areas of air quality, ice monitoring, farming, climate change, floods and surveillance. HDI APIs were used by the authors to access specific Copernicus data in Python. WEkEO allows users to select and download specific areas of the Arctic, based on the user request.","P. Breda; HyImpulse Technologies GmbH, Neuenstadt am Kocher, Germany; email: breda@hyimpulse.de","","International Astronautical Federation, IAF","","73rd International Astronautical Congress, IAC 2022","18 September 2022 through 22 September 2022","Paris","190266","00741795","","","","English","Proc. Int. Astronaut. Congr., IAC","Conference paper","Final","","Scopus","2-s2.0-85167574421"
"Abdin A.; Amberger S.; Apollonio E.; De Fourtou G.B.; Bolmgren K.; Ciocca G.; Ekal M.; Garcia A.; Godeanu A.; Irrera D.; Lidgard L.C.L.; Lorini G.; Monat S.; Montenegro J.; Oleary A.; Onn O.; Pauzie L.; Pouwels C.; Sokolowski A.; Tian Z.; Za A.","Abdin, Adam (57224782100); Amberger, Stefan (55199123300); Apollonio, Emily (57554472000); De Fourtou, Gautier Bardi (57555171300); Bolmgren, Karl (57204504124); Ciocca, Gianmarco (57219630238); Ekal, Monica (57202608465); Garcia, Alan (57554937200); Godeanu, Adina (57554937300); Irrera, Damiana (57555171400); Lidgard, Leonard C. L. (57554007000); Lorini, Giorgio (57555628100); Monat, Shay (57219552027); Montenegro, Joao (57554233600); Oleary, Aiden (57409119700); Onn, Ori (57554937400); Pauzie, Laura (57554704100); Pouwels, Charlotte (57555170900); Sokolowski, Alexandra (57554937500); Tian, Zhuang (57223684775); Za, Alberto (57554007100)","57224782100; 55199123300; 57554472000; 57555171300; 57204504124; 57219630238; 57202608465; 57554937200; 57554937300; 57555171400; 57554007000; 57555628100; 57219552027; 57554233600; 57409119700; 57554937400; 57554704100; 57555170900; 57554937500; 57223684775; 57554007100","Solutions for construction of a lunar base: A proposal to use the spacex starship as a permanent habitat","2021","Proceedings of the International Astronautical Congress, IAC","A3","","","","","","3","","https://www.scopus.com/inward/record.uri?eid=2-s2.0-85127289946&partnerID=40&md5=d6e8616732027e0f53761e5d4a419423","International Space University, Strasbourg, France; Laboratoire Genie Industriel, CentraleSupelec, Universite Paris-Saclay, Gif-sur-Yvette, France; Department of Physics, KTH Royal Institute of Technology, Stockholm, Sweden; Centre for Sports Science and University Sports, University of Vienna, Vienna, Austria; Institute for Systems and Robotics, Instituto Superior Tecnico, Lisbon, Portugal; Politecnico di Milano, Milan, Italy; School of Mechanical Engineering, Tel-Aviv University, Tel-Aviv, Israel; Orbit Fab, San Francisco, United States; ILEWG EuroMoonMars, Netherlands; International Institute of Air and Space Law, Leiden University, Leiden, Netherlands","Abdin A., International Space University, Strasbourg, France, Laboratoire Genie Industriel, CentraleSupelec, Universite Paris-Saclay, Gif-sur-Yvette, France; Amberger S., International Space University, Strasbourg, France; Apollonio E., International Space University, Strasbourg, France; De Fourtou G.B., International Space University, Strasbourg, France; Bolmgren K., International Space University, Strasbourg, France, Department of Physics, KTH Royal Institute of Technology, Stockholm, Sweden; Ciocca G., International Space University, Strasbourg, France, Centre for Sports Science and University Sports, University of Vienna, Vienna, Austria; Ekal M., International Space University, Strasbourg, France, Institute for Systems and Robotics, Instituto Superior Tecnico, Lisbon, Portugal; Garcia A., International Space University, Strasbourg, France; Godeanu A., International Space University, Strasbourg, France; Irrera D., International Space University, Strasbourg, France, Politecnico di Milano, Milan, Italy; Lidgard L.C.L., International Space University, Strasbourg, France; Lorini G., International Space University, Strasbourg, France; Monat S., International Space University, Strasbourg, France, School of Mechanical Engineering, Tel-Aviv University, Tel-Aviv, Israel; Montenegro J., International Space University, Strasbourg, France; Oleary A., International Space University, Strasbourg, France, Orbit Fab, San Francisco, United States; Onn O., International Space University, Strasbourg, France; Pauzie L., International Space University, Strasbourg, France; Pouwels C., International Space University, Strasbourg, France, ILEWG EuroMoonMars, Netherlands; Sokolowski A., International Space University, Strasbourg, France; Tian Z., International Space University, Strasbourg, France, International Institute of Air and Space Law, Leiden University, Leiden, Netherlands; Za A., International Space University, Strasbourg, France","Returning to the Moon and establishing a permanent human presence is the next step in human space exploration. This necessitates the development of lunar infrastructure up to this task. This contribution presents a framework for rapid, cost-efficient, and supporting construction of a permanent and modular lunar base within the scope of what will be technically and legally feasible today. The proposed concept uses the SpaceX Starship Human Landing System as the foundation for a lunar base. The Starship will be placed horizontally on the lunar surface and transformed into a habitable volume. A workforce of modular rovers will aid astronauts in the construction process, and an array of countermeasures are presented to protect the astronauts from the effects of exposure to radiation, lunar dust, and extended hypogravity. Psychological and psychosocial factors are included to enhance individual well-being and crew dynamics. Physical and cognitive workloads are defined and evaluated to identify effective countermeasures, including specific spacesuit requirements. The proposed construction activities are to be organized as a multi-national public-private partnership to establish an international authority, a concept that has been successful on Earth but has yet to be applied to space activities on a multi-national level. A roadmap incorporating each part of the construction from human and technical perspectives is outlined. Other aspects that are critical to mission success include the cultural significance of the project, legal aspects, budget, financing, and potential future uses of the base. These solutions rely mainly on existing technologies and limited modifications to the lunar lander vehicle, making it a viable solution for the construction of a lunar base in the near future. © 2021 International Astronautical Federation, IAF. All rights reserved.","Human spaceflight; Lunar base; Public-private partnership; Space exploration; Space law","Budget control; Construction industry; Earth (planet); Interplanetary flight; Lunar missions; Radiation effects; Rovers; Space research; Cost-efficient; Human space explorations; Human spaceflights; Lunar base; Modulars; Multi-nationals; Public/private partnerships; Space explorations; Space laws; Starship; Manned space flight","","","","","","","C. Pouwels; International Space University, Strasbourg, France; email: charlotte.pouwels@gmail.com","","International Astronautical Federation, IAF","","IAF Space Exploration Symposium 2021 at the 72nd International Astronautical Congress, IAC 2021","25 October 2021 through 29 October 2021","Dubai","177573","00741795","978-171384296-5","","","English","Proc. Int. Astronaut. Congr., IAC","Conference paper","Final","","Scopus","2-s2.0-85127289946"
"Breda P.; Markova R.; Abdin A.F.; Jha D.; Carlo A.; Mantı N.P.","Breda, Paola (57209582525); Markova, Rada (58531024500); Abdin, Adam F. (57224782100); Jha, Devanshu (57219760916); Carlo, Antonio (57208624091); Mantı, Nebile Pelin (57222004188)","57209582525; 58531024500; 57224782100; 57219760916; 57208624091; 57222004188","Cyber Vulnerabilities and Risks of AI Technologies in Space Applications","2022","Proceedings of the International Astronautical Congress, IAC","2022-September","","","","","","1","","https://www.scopus.com/inward/record.uri?eid=2-s2.0-85167590049&partnerID=40&md5=7866eca9f300500ffc7ae5b60b069b53","HyImpulse Technologies GmbH, Neuenstadt am Kocher, Germany; Space Generation Advisory Council (SGAC), Vienna, Austria; Université Paris-Saclay, CentraleSupélec, Laboratoire Génie Industriel, Gif-sur-Yvette, 91190, France; MVJ College of Engineering, Bangalore, India; Tallinn University of Technology, Tallin, Estonia; PIL Department, Istanbul University, Faculty of Law, Istanbul, Turkey","Breda P., HyImpulse Technologies GmbH, Neuenstadt am Kocher, Germany; Markova R., Space Generation Advisory Council (SGAC), Vienna, Austria; Abdin A.F., Université Paris-Saclay, CentraleSupélec, Laboratoire Génie Industriel, Gif-sur-Yvette, 91190, France; Jha D., MVJ College of Engineering, Bangalore, India; Carlo A., Tallinn University of Technology, Tallin, Estonia; Mantı N.P., PIL Department, Istanbul University, Faculty of Law, Istanbul, Turkey","Artificial Intelligence (AI) is becoming a key technology for space applications. Recently, AI has come into extensive use in spacecraft operations, for example to support highly efficient operations of satellite constellations. This ranges in applications from relative positioning, Earth Observation, autonomous navigation, and end-of-life management, among others. While the importance of AI is rising for new space assets, AI is vulnerable to cyber threats, and AI cyber security is becoming an important aspect of space safety and operational security. This work aims to identify the vulnerabilities that AI systems may introduce to space assets and to analyse the potential operational threats and effective technological and regulatory mitigation measures. Towards this goal, the paper first examines and differentiates between vulnerabilities in legacy space systems, and those that are particularly related to AI technologies. The analysis covers the definition of AI technology as well as a detailed discussion about its current use in space related applications. Secondly, a comparison between prevailing cyber-attacks in space and cyber-attacks targeting AI technologies is made. Based on this assessment, the paper recommends prevention and mitigation measures that are contingent on cyber resilience of space operations focusing on AI-based space applications. Copyright © IAC 2022 by Space Generation Advisory Council (SGAC). Published by the IAF, with permission and released to the IAF to publish in all forms.","Artificial Intelligence; Cyber-vulnerabilities; Mitigation; Prevention; Space Applications","Artificial intelligence; Crime; Cybersecurity; Legacy systems; Space applications; Artificial intelligence technologies; Cyber vulnerabilities; Cyber-attacks; Key technologies; Mitigation; Mitigation measures; Prevention; Satellite constellations; Space assets; Spacecraft operation; Network security","","","","","","","P. Breda; HyImpulse Technologies GmbH, Neuenstadt am Kocher, Germany; email: breda@hyimpulse.de","","International Astronautical Federation, IAF","","73rd International Astronautical Congress, IAC 2022","18 September 2022 through 22 September 2022","Paris","190266","00741795","","","","English","Proc. Int. Astronaut. Congr., IAC","Conference paper","Final","","Scopus","2-s2.0-85167590049"
"Bellè A.; Abdin A.F.; Fang Y.-P.; Zeng Z.; Barros A.","Bellè, Andrea (57286978200); Abdin, Adam F. (57224782100); Fang, Yi-Ping (55659850100); Zeng, Zhiguo (55348807500); Barros, Anne (7102745133)","57286978200; 57224782100; 55659850100; 55348807500; 7102745133","A data-driven distributionally robust approach for the optimal coupling of interdependent critical infrastructures under random failures","2023","European Journal of Operational Research","309","2","","872","889","17","1","10.1016/j.ejor.2023.01.060","https://www.scopus.com/inward/record.uri?eid=2-s2.0-85147705423&doi=10.1016%2fj.ejor.2023.01.060&partnerID=40&md5=26210a212e4673944c61053410e5624f","Thales Research & Technology, Palaiseau, France; Chair on Risk and Resilience of Complex Systems, Laboratoire Génie Industriel, CentraleSupélec, Université Paris-Saclay, 3 Rue Joliot Curie, Gif-sur-Yvette, 91190, France; Laboratoire Génie Industriel, CentraleSupélec, Université Paris-Saclay, 3 Rue Joliot Curie, Gif-sur-Yvette, 91190, France","Bellè A., Thales Research & Technology, Palaiseau, France, Chair on Risk and Resilience of Complex Systems, Laboratoire Génie Industriel, CentraleSupélec, Université Paris-Saclay, 3 Rue Joliot Curie, Gif-sur-Yvette, 91190, France; Abdin A.F., Laboratoire Génie Industriel, CentraleSupélec, Université Paris-Saclay, 3 Rue Joliot Curie, Gif-sur-Yvette, 91190, France; Fang Y.-P., Chair on Risk and Resilience of Complex Systems, Laboratoire Génie Industriel, CentraleSupélec, Université Paris-Saclay, 3 Rue Joliot Curie, Gif-sur-Yvette, 91190, France; Zeng Z., Chair on Risk and Resilience of Complex Systems, Laboratoire Génie Industriel, CentraleSupélec, Université Paris-Saclay, 3 Rue Joliot Curie, Gif-sur-Yvette, 91190, France; Barros A., Chair on Risk and Resilience of Complex Systems, Laboratoire Génie Industriel, CentraleSupélec, Université Paris-Saclay, 3 Rue Joliot Curie, Gif-sur-Yvette, 91190, France","Critical infrastructures (CIs), such as energy systems, transportation networks and telecommunications networks, are the backbone of any advanced society, and ensuring their resilience is a fundamental task. CIs are often interconnected to, and interdependent on, each other through complex coupling interfaces. Failures can propagate among different CIs through these coupling interfaces, causing multi-sectoral disruption. The design of the coupling interface can strongly impact the cascading effect between different CIs. In this paper, we propose a data-driven distributionally robust approach for the optimal coupling of interdependent CIs. Our model obtains an optimal coupling interface that maximizes the expected combined performance of interdependent CIs under random failure scenarios with ambiguous probability distributions. We demonstrate the validity of the proposed approach using an ambiguity set built upon a synthetic data set of historical contingency scenarios. Interdependent power and gas networks (IPGNs) are used as an illustrative case study. We show that our proposed approach leads to better coupling interfaces with higher expected performance under disruptive scenarios. © 2023 Elsevier B.V.","Coupling interface; Distributionally robust optimization; Interdependent critical infrastructures; Random failures; Risk analysis","Critical infrastructures; Failure (mechanical); Optimization; Probability distributions; Public works; Risk assessment; Coupling interfaces; Data driven; Distributionally robust optimization; Energy systems; Interdependent critical infrastructure; Performance; Random failures; Robust approaches; Robust optimization; Transportation network; Risk analysis","","","","","","","A. Bellè; Thales Research & Technology, Palaiseau, France; email: andrea.belle@thalesgroup.com","","Elsevier B.V.","","","","","","03772217","","EJORD","","English","Eur J Oper Res","Article","Final","","Scopus","2-s2.0-85147705423"
