"Authors","Author full names","Author(s) ID","Title","Year","Source title","Volume","Issue","Art. No.","Page start","Page end","Page count","Cited by","DOI","Link","Affiliations","Authors with affiliations","Abstract","Author Keywords","Index Keywords","Molecular Sequence Numbers","Chemicals/CAS","Tradenames","Manufacturers","Funding Details","Funding Texts","Correspondence Address","Editors","Publisher","Sponsors","Conference name","Conference date","Conference location","Conference code","ISSN","ISBN","CODEN","PubMed ID","Language of Original Document","Abbreviated Source Title","Document Type","Publication Stage","Open Access","Source","EID"
"Abdin A.; Li Y.-F.; Zio E.","Abdin, Adam (57224782100); Li, Yan-Fu (56609542700); Zio, Enrico (7005289082)","57224782100; 56609542700; 7005289082","Risk assessment of power transmission network failures in a uniform pricing electricity market environment","2017","Energy","138","","","1042","1055","13","11","10.1016/j.energy.2017.07.115","https://www.scopus.com/inward/record.uri?eid=2-s2.0-85026514771&doi=10.1016%2fj.energy.2017.07.115&partnerID=40&md5=ad94c8686b6200d8af31e6bef2096255","Laboratoire Genie Industriel, CentraleSupélec, Université Paris-Saclay, Grande voie des Vignes, Chair Systems Science and the Energy Challenge, Fondation Electricité de France (EDF), Chatenay-Malabry, 92290, France; Department of Industrial Engineering, Tsinghua University, China; Politecnico di Milano, Italy","Abdin A., Laboratoire Genie Industriel, CentraleSupélec, Université Paris-Saclay, Grande voie des Vignes, Chair Systems Science and the Energy Challenge, Fondation Electricité de France (EDF), Chatenay-Malabry, 92290, France; Li Y.-F., Department of Industrial Engineering, Tsinghua University, China; Zio E., Laboratoire Genie Industriel, CentraleSupélec, Université Paris-Saclay, Grande voie des Vignes, Chair Systems Science and the Energy Challenge, Fondation Electricité de France (EDF), Chatenay-Malabry, 92290, France, Politecnico di Milano, Italy","This paper proposes a novel risk assessment method for power network failures considering a uniform-pricing market environment, different from previous risk assessment studies, which mainly emphasize technical consequences of the failures. In this type of market, dispatch infeasibilities caused by line failures are solved using a counter-trading mechanism where costs arise as a result of correcting the power dispatch. The risk index proposed takes into account these correction costs as well as the cost of the energy not served due to the failure, while considering an oligopolistic behavior of the generation companies. A 3-stage model is proposed to simulate the bidding behavior in the market, under different line failures scenarios. The risk index proposed and the method for its calculation are applied on an adapted IEEE 6-bus reliability test system. A sensitivity analysis is performed to investigate the sensitivity of the results with respect to the level of competitiveness of the generation companies, measured by the conjectured-price response parameter which is assumed to be exogenous in our study. © 2017 Elsevier Ltd","Conjectural-variation equilibrium; Direct-current optimal power flow; Electricity market; Line failure; Risk assessment; Transmission network","Cost benefit analysis; Electric industry; Electric load dispatching; Electric load flow; Electric network analysis; Electric power transmission; Electric power transmission networks; Outages; Power markets; Sensitivity analysis; Conjectural variations; Conjectural-variation equilibrium; Direct-current; Direct-current optimal power flow; Line failure; Market environment; Network failure; Optimal power flows; Risks assessments; Uniform pricing; competitiveness; electricity supply; energy market; network analysis; price dynamics; risk assessment; sensitivity analysis; three-dimensional modeling; Risk assessment","","","","","","","Y.-F. Li; Department of Industrial Engineering, Tsinghua University, China; email: liyanfu@tsinghua.edu.cn","","Elsevier Ltd","","","","","","03605442","","ENEYD","","English","Energy","Article","Final","All Open Access; Green Open Access","Scopus","2-s2.0-85026514771"
"Abdin A.F.; Fang Y.-P.; Zio E.","Abdin, A.F. (57224782100); Fang, Y.-P. (55659850100); Zio, E. (7005289082)","57224782100; 55659850100; 7005289082","A modeling and optimization framework for power systems design with operational flexibility and resilience against extreme heat waves and drought events","2019","Renewable and Sustainable Energy Reviews","112","","","706","719","13","51","10.1016/j.rser.2019.06.006","https://www.scopus.com/inward/record.uri?eid=2-s2.0-85067341710&doi=10.1016%2fj.rser.2019.06.006&partnerID=40&md5=bd780cdabe630bd79e3c32d1e0f6fcdf","Laboratoire Genie Industriel, CentraleSupélec, Université Paris-Saclay, Université Paris-Saclay, Chair on Systems Science and the Energy Challenge, Fondation Electricité de France (EDF), 3 Rue Joliot Curie, 91190, Gif-sur-Yvette, France; Mines ParisTech, PSL Research University, CRC, Sophia Antipolis, France; Department of Energy, Politecnico di Milano, Italy; Department of Nuclear Energy, Kyung Hee University, South Korea","Abdin A.F., Laboratoire Genie Industriel, CentraleSupélec, Université Paris-Saclay, Université Paris-Saclay, Chair on Systems Science and the Energy Challenge, Fondation Electricité de France (EDF), 3 Rue Joliot Curie, 91190, Gif-sur-Yvette, France; Fang Y.-P., Laboratoire Genie Industriel, CentraleSupélec, Université Paris-Saclay, Université Paris-Saclay, Chair on Systems Science and the Energy Challenge, Fondation Electricité de France (EDF), 3 Rue Joliot Curie, 91190, Gif-sur-Yvette, France; Zio E., Mines ParisTech, PSL Research University, CRC, Sophia Antipolis, France, Department of Energy, Politecnico di Milano, Italy, Department of Nuclear Energy, Kyung Hee University, South Korea","Operational flexibility is an important attribute for the design of sustainable power systems with a high share of intermittent renewable energy sources (IRES). Resilience against extreme weather is also becoming an important concern. In this study, a modeling and optimization framework for power systems planning, which considers both operational flexibility and resilience against extreme weather events, is proposed. In particular, a set of piece-wise linear models are developed to capture the impact of extreme heat waves and drought events on the performance of the power generation units and on the system load. A method is, also, proposed to incorporate the impact models within a modified optimal power system planning problem that can adequately accommodate high shares of IRES. The framework is applied to a case study based on real future climate projections from the Coupled Model Intercomparison Project phase 5 (CMIP5) under different levels of IRES penetration (up to 50%) and severity of the extreme weather events. A sensitivity analysis is conducted for planning under different Representative Concentration Pathways (RCPs) that cover the impact of different trajectories of greenhouse gas concentration on future climate. In particular, RCPs with increase in radiative forcing of +8.5 Wm-2, +4.5 Wm-2 and +2.6 Wm-2 of the pre-industrial levels are considered. The results demonstrate that significant improvements in terms of load supply under an extreme heat wave and drought events can be achieved following the resilient planning framework proposed, compared to conventional planning methods. It is also shown how renewable generation units can improve the system performance against those extreme climate events. Moreover, the quantitative assessment indicates an important interaction between the resilience of the system and its flexibility, and the compound impact of failing to consider either aspect in the power system design phase. © 2019 Elsevier Ltd","Extreme weather events; Operational flexibility; Power system design; Power system resilience; Renewable energy penetration","Atmospheric radiation; Climate models; Greenhouse gases; Sensitivity analysis; Systems analysis; Weather information services; Extreme weather events; Heatwaves; Modelling framework; Operational flexibility; Power; Power system designs; Power system resilience; Renewable energy penetrations; Renewable energy source; System resiliences; Drought","","","","","","","E. Zio; Mines ParisTech, PSL Research University, CRC, France; email: enrico.zio@polimi.it","","Elsevier Ltd","","","","","","13640321","","RSERF","","English","Renewable Sustainable Energy Rev","Article","Final","All Open Access; Bronze Open Access; Green Open Access","Scopus","2-s2.0-85067341710"
"Abdin A.F.; Caunhye A.; Zio E.; Cardin M.-A.","Abdin, Adam F. (57224782100); Caunhye, Aakil (37664713800); Zio, Enrico (7005289082); Cardin, Michel-Alexandre (16308654600)","57224782100; 37664713800; 7005289082; 16308654600","Optimizing generation expansion planning with operational uncertainty: A multistage adaptive robust approach","2022","Applied Energy","306","","118032","","","","19","10.1016/j.apenergy.2021.118032","https://www.scopus.com/inward/record.uri?eid=2-s2.0-85121009628&doi=10.1016%2fj.apenergy.2021.118032&partnerID=40&md5=1bb66462ad0eb10ecc9aa38b97a3d28f","Laboratoire Genie Industriel, CentraleSupélec, université Paris-Saclay 3 Rue Joliot Curie, 91190 Gif-sur-Yvette, France; University of Edinburgh Business School, Edinburgh, United Kingdom; Mines ParisTech, PSL Research University, CRC, Sophia Antipolis, France; Department of Energy, Politecnico di Milano, Italy; Dyson School of Design Engineering, Imperial College London, United Kingdom","Abdin A.F., Laboratoire Genie Industriel, CentraleSupélec, université Paris-Saclay 3 Rue Joliot Curie, 91190 Gif-sur-Yvette, France; Caunhye A., University of Edinburgh Business School, Edinburgh, United Kingdom; Zio E., Mines ParisTech, PSL Research University, CRC, Sophia Antipolis, France, Department of Energy, Politecnico di Milano, Italy; Cardin M.-A., Dyson School of Design Engineering, Imperial College London, United Kingdom","This paper presents a multistage adaptive robust generation expansion planning model, which accounts for short-term unit commitment and ramping constraints, considers multi-period and multi-regional planning, and maintains the integer representation of generation units. The uncertainty of electricity demand and renewable power generation is taken into account through bounded intervals, with parameters that permit control over the level of conservatism of the solution. The multistage robust optimization model allows the sequential representation of uncertainty realization as they are revealed over time. It also guarantees the non-anticipativity of future uncertainty realizations at the time of decision-making, which is the case in practical real-world applications, as opposed to two-stage robust and stochastic models. To render the resulting multistage robust problem tractable, decision rules are employed to cast the uncertainty-based model into an equivalent mixed integer linear (MILP) problem. The re-formulated MILP problem, while tractable, is computationally prohibitive even for moderately sized systems. We, thus, propose a solution method relying on the reduction of the information basis of the decision rules employed in the model, and validate its adequacy to efficiently solve the problem. The importance of considering multistage robust frameworks for accounting for net-load uncertainties in generation expansion planning is illustrated, particularly under a high share of renewable energy penetration. A number of renewable penetration scenarios and uncertainty levels are considered for a case study covering future generation expansion planning in Europe. The results confirm the effectiveness of the proposed approach in coping with multifold operational uncertainties and for deriving adequate generation investment decisions. Moreover, the quality of the solutions obtained and the computational performance of the proposed solution method is shown to be suitable for practical policy-making generation expansion planning problems, seeking to evaluate the impact of uncertainty on future system-wide performance. © 2021 Elsevier Ltd","Generation expansion planning; High renewable energy systems; Multistage adaptive robust optimization; Uncertainty treatment; Unit commitment","Europe; Decision making; Integer programming; Investments; Quality control; Regional planning; Stochastic models; Stochastic systems; Decision rules; Generation expansion planning; High renewable energy system; Multi-stages; Multistage adaptive robust optimization; Robust optimization; Solution methods; Uncertainty; Uncertainty treatment; Unit Commitment; alternative energy; electricity; future prospect; policy making; power generation; range expansion; Renewable energy resources","","","","","National University of Singapore, NUS, (R-266-000-070-281, WBS R-266-000-089-592); National Research Foundation Singapore, NRF","The authors would like to thank Dr. Elizaveta Kuznetsova for her feedback and support in the early stages of the work. This work was partially supported by the Future Resilient Systems project at the Singapore-ETH Center (SEC), which is funded by the National Research Foundation of Singapore (NRF), Prime Minister’s Office, Singapore , under its Campus for Research Excellence and Technological Enterprise (CREATE) program. The project is administered by the National University of Singapore (NUS) under grants WBS R-266-000-089-592 and R-266-000-070-281 . ","A.F. Abdin; Laboratoire Genie Industriel, CentraleSupélec, université Paris-Saclay 3 Rue Joliot Curie, 91190 Gif-sur-Yvette, France; email: adam.abdin@centralesupelec.fr","","Elsevier Ltd","","","","","","03062619","","APEND","","English","Appl. Energy","Article","Final","All Open Access; Bronze Open Access; Green Open Access","Scopus","2-s2.0-85121009628"
"Bellè A.; Abdin A.F.; Fang Y.-P.; Zeng Z.; Barros A.","Bellè, Andrea (57286978200); Abdin, Adam F. (57224782100); Fang, Yi-Ping (55659850100); Zeng, Zhiguo (55348807500); Barros, Anne (7102745133)","57286978200; 57224782100; 55659850100; 55348807500; 7102745133","A resilience-based framework for the optimal coupling of interdependent critical infrastructures","2023","Reliability Engineering and System Safety","237","","109364","","","","0","10.1016/j.ress.2023.109364","https://www.scopus.com/inward/record.uri?eid=2-s2.0-85159205217&doi=10.1016%2fj.ress.2023.109364&partnerID=40&md5=d9acbb52fed309e41609dca4e933f566","Thales Research & Technology, Palaiseau, France; Chair on Risk and Resilience of Complex Systems, Laboratoire Génie Industriel, CentraleSupélec, Université Paris-Saclay, 3 Rue Joliot Curie, Gif-sur-Yvette, 91190, France; Laboratoire Génie Industriel, CentraleSupélec, université Paris-Saclay, 3 Rue Joliot Curie, Gif-sur-Yvette, 91190, France","Bellè A., Thales Research & Technology, Palaiseau, France, Chair on Risk and Resilience of Complex Systems, Laboratoire Génie Industriel, CentraleSupélec, Université Paris-Saclay, 3 Rue Joliot Curie, Gif-sur-Yvette, 91190, France; Abdin A.F., Laboratoire Génie Industriel, CentraleSupélec, université Paris-Saclay, 3 Rue Joliot Curie, Gif-sur-Yvette, 91190, France; Fang Y.-P., Chair on Risk and Resilience of Complex Systems, Laboratoire Génie Industriel, CentraleSupélec, Université Paris-Saclay, 3 Rue Joliot Curie, Gif-sur-Yvette, 91190, France; Zeng Z., Chair on Risk and Resilience of Complex Systems, Laboratoire Génie Industriel, CentraleSupélec, Université Paris-Saclay, 3 Rue Joliot Curie, Gif-sur-Yvette, 91190, France; Barros A., Chair on Risk and Resilience of Complex Systems, Laboratoire Génie Industriel, CentraleSupélec, Université Paris-Saclay, 3 Rue Joliot Curie, Gif-sur-Yvette, 91190, France","As critical infrastructures (CIs) are essential for the safety and socio-economic stability of a society, ensuring their resilience is a task of the utmost importance. Critical infrastructures are often interdependent on each other, and the topology of the interdependencies between different systems, also referred to as coupling interface, plays a key role in terms of their resilience against failures. In case of failures due to natural events, random disturbances, or deliberate attacks, the design of the coupling interface is a key factor for maintaining high performance within the interdependent CIs. However, in the existing literature, the issue of the coupling interface design is often addressed through heuristics. In this work, we propose an optimization-based mathematical approach for designing coupling interfaces between interdependent critical infrastructures under random failures. The proposed approach allows designing a coupling interface that is robust against the worst realization of a set of feasible failure scenarios. Using as case study interdependent power and gas networks, we show that the proposed method outperforms existing solutions based on network metrics-based heuristics. © 2023 Elsevier Ltd","Coupling interface; Defender–attacker–defender; Interdependent critical infrastructures; Optimization; Resilience","Critical infrastructures; Heuristic methods; Public works; Coupling interfaces; Defender–attacker–defender; Economic stability; Interdependent critical infrastructure; Key factors; Natural events; Optimisations; Random disturbances; Resilience; Socio-economics; Optimization","","","","","","","A. Bellè; Thales Research & Technology, Palaiseau, France; email: andrea.belle@thalesgroup.com","","Elsevier Ltd","","","","","","09518320","","RESSE","","English","Reliab Eng Syst Saf","Article","Final","All Open Access; Bronze Open Access; Green Open Access","Scopus","2-s2.0-85159205217"
"Abdin A.; Zio E.","Abdin, Adam F (57224782100); Zio, Enrico (7005289082)","57224782100; 7005289082","An integrated framework for operational flexibility assessment in multi-period power system planning with renewable energy production","2018","Applied Energy","222","","","898","914","16","59","10.1016/j.apenergy.2018.04.009","https://www.scopus.com/inward/record.uri?eid=2-s2.0-85046172210&doi=10.1016%2fj.apenergy.2018.04.009&partnerID=40&md5=d8268a8f1bf8bbb33184ccc380d7de7e","Laboratoire Genie Industriel, CentraleSupélec, Université Paris-Saclay, 3 Rue Joliot Curie, Gif-sur-Yvette, 91190, France; Chair Systems Science and the Energy Challenge, Fondation Electricité de France (EDF), France; Department of Energy, Politecnico di Milano, Italy","Abdin A., Laboratoire Genie Industriel, CentraleSupélec, Université Paris-Saclay, 3 Rue Joliot Curie, Gif-sur-Yvette, 91190, France, Chair Systems Science and the Energy Challenge, Fondation Electricité de France (EDF), France; Zio E., Laboratoire Genie Industriel, CentraleSupélec, Université Paris-Saclay, 3 Rue Joliot Curie, Gif-sur-Yvette, 91190, France, Chair Systems Science and the Energy Challenge, Fondation Electricité de France (EDF), France, Department of Energy, Politecnico di Milano, Italy","This paper proposes an integrated framework for operational flexibility assessment in power system planning with a significant share of intermittent renewable energy sources (RES). The framework proposed includes: (i) the formulation of an integrated generation expansion planning (GEP) and unit commitment (UC) model accounting for key short-term technical constraints, (ii) the elaboration of accurate and systematic horizon reduction methods to alleviate the computational burden of the resulting large-sized optimization problems and (iii) the definition of suitable metrics for the operational flexibility assessment of the obtained plans. The framework is applied to a ten year planning horizon of a realistically sized case study representing the national power system of France, under several scenarios of RES penetration levels and carbon limits, spanning levels of up to 50%. The importance of incorporating the detailed short-term constraints within long-term planning models is shown. The results of the assessment show that, under high renewable energy penetration, neglecting the short-term constraints may lead to plans significantly short on flexibility, reaching shortage levels of up to 50% in frequency and several GWs in magnitude. Also, the load not served reaches levels of up to 3% and carbon emission is underestimated by up to 60%. Furthermore, the results highlight the importance of relying on suitable quantitative metrics for operational flexibility assessment in power systems planning rather than solely relying on generic performance measures, such as system costs and mixes of power plants, which are shown not to sufficiently reflect the flexibility levels of the obtained plans. © 2018 Elsevier Ltd","Flexibility metrics; Generation expansion planning; Operational flexibility; Optimization; Renewable energy penetration; Unit commitment","France; Carbon; Electric power system planning; Flexibility metric; Generation expansion planning; Integrated frameworks; Multi-period; Operational flexibility; Optimisations; Power systems planning; Renewable energy penetrations; Renewable energy source; Unit Commitment; alternative energy; assessment method; carbon emission; conceptual framework; energy planning; integrated approach; optimization; power generation; renewable resource; Renewable energy resources","","","","","","","E. Zio; Department of Energy, Politecnico di Milano, Italy; email: enrico.zio@centralesupelec.fr","","Elsevier Ltd","","","","","","03062619","","APEND","","English","Appl. Energy","Article","Final","All Open Access; Green Open Access","Scopus","2-s2.0-85046172210"
"Mantı N.P.; Carlo A.; Breda P.; Boschetti N.; Jha D.; Abdin A.","Mantı, Nebile Pelin (57222004188); Carlo, Antonio (57208624091); Breda, Paola (57209582525); Boschetti, Nicolò (57373884900); Jha, Devanshu (57219760916); Abdin, Adam (57224782100)","57222004188; 57208624091; 57209582525; 57373884900; 57219760916; 57224782100","“AI systems to ensure cyber security in space”","2022","Proceedings of the International Astronautical Congress, IAC","2022-September","","","","","","1","","https://www.scopus.com/inward/record.uri?eid=2-s2.0-85167595711&partnerID=40&md5=1fd02954473a23777b23cb915ceb8593","PIL Dept., Istanbul University, Faculty of Law, Istanbul, Turkey; Tallinn University of Technology, Tallinn, Estonia; HyImpulse Technologies GmbH, Neuenstadt am Kocher, Germany; Johns Hopkins University, Baltimore, MD, United States; Space Generation Advisory Council (SGAC); CentraleSupélec, France","Mantı N.P., PIL Dept., Istanbul University, Faculty of Law, Istanbul, Turkey; Carlo A., Tallinn University of Technology, Tallinn, Estonia; Breda P., HyImpulse Technologies GmbH, Neuenstadt am Kocher, Germany; Boschetti N., Johns Hopkins University, Baltimore, MD, United States; Jha D., Space Generation Advisory Council (SGAC); Abdin A., CentraleSupélec, France","The space environment is becoming more congested, complex, and contested, no longer being a sanctuary for space assets. The use of Artificial Intelligence (AI) technologies is on the rise everywhere in the space industry. AI allows the rapid analysis of millions of events and identifies a wide range of threats - from malware exploiting zero-day vulnerabilities to the identification of risky behaviours that may lead to a phishing attack or the download of malicious code. These systems learn over time, they identify new types of attacks, by analysing the behavioural history of user profiles, assets and networks and respond on time to deviations from established norms. This paper attempts to answer the question of whether or not AI can be used to prevent cyber attacks in space and explores this new avenue of AI being utilized in the space cyber security domain. This analysis covers different AI approaches and applications used in cyber security, such as Network Security, Vulnerability Management (Proactive versus Reactive), Prevention Control and Phishing Detection (detect, track, react, solve) and behavioural analytics, as well as their limitations within the space sector. Secondly, the paper discusses the potential of AI for being used to breach cyber security, particularly by introducing new attack vectors. Moreover, the paper addresses liability issues as to the use and deployment of AI-based space applications, in particular, concerning cyber security breaches. Finally, this work attempts to highlight the best practices of AI for cyber security in space, discuss a preliminary technical and legal roadmap, take into account the different levels of cyber vulnerability of AI, and discuss short-term and long-term strategies for preventing cyberattacks on AI assets in space. Copyright © 2022 by the International Astronautical Federation (IAF). All rights reserved.","Artificial Intelligence; Cyber Risk; Cybersecurity; Vulnerability Management","Artificial intelligence; Malware; Space applications; Zero-day attack; Artificial intelligence systems; Artificial intelligence technologies; Cybe risk; Cyber security; Cyber-attacks; Rapid analysis; Space assets; Space environment; Space industry; Vulnerability management; Cybersecurity","","","","","","","N.P. Mantı; PIL Dept., Istanbul University Faculty of Law, Istanbul, Turkey; email: np_manti@yahoo.com","","International Astronautical Federation, IAF","","73rd International Astronautical Congress, IAC 2022","18 September 2022 through 22 September 2022","Paris","190266","00741795","","","","English","Proc. Int. Astronaut. Congr., IAC","Conference paper","Final","","Scopus","2-s2.0-85167595711"
