eid,doi,pii,pubmed_id,title,subtype,subtypeDescription,creator,afid,affilname,affiliation_city,affiliation_country,author_count,author_names,author_ids,author_afids,coverDate,coverDisplayDate,publicationName,issn,source_id,eIssn,aggregationType,volume,issueIdentifier,article_number,pageRange,description,authkeywords,citedby_count,openaccess,freetoread,freetoreadLabel,fund_acr,fund_no,fund_sponsor
2-s2.0-85110355671,10.1017/dsd.2020.130,S2633776220001302,,DESIGN-FOR-COST-AND-ENVIRONMENT: ONTOLOGICAL ANALYSIS and COMPARISON of SERVICE REPRESENTATION APPROACHES,cp,Conference Paper,Villanueva M.,60106088;60104081,CentraleSupélec;Orange Labs,Gif-sur-Yvette;Issy-les-Moulineaux,France;France,6,"Villanueva, M.;Yannou, B.;Leroy, Y.;Cluzel, F.;Vautier, M.;Vaija, S.",57226081905;6602469780;55860799691;55099201800;6508316642;57206658505,60106088-60104081;60106088;60106088;60106088;60104081;60104081,2020-01-01,2020,Proceedings of the Design Society: DESIGN Conference,26337762,21101052805,,Conference Proceeding,1,,,2197-2206,"Brought by the need for competent approaches to assess the financial cost and environmental impact towards service design-for-cost-and-environment, this paper investigates on the following service representation approaches: Service Blueprinting, Process Chain Network, Business Process Model & Notation, and Customer Journey Mapping. An ontological analysis further compares their similarities and differences. Lastly, a table summarizes the findings, were further insights could be drawn to help service companies be more aware of both their spending and ecological responsibility.",design for x (DfX) | design methods | digital services | ecodesign | ontological analysis,0,1,publisherfullgold,Gold,,undefined,
2-s2.0-85099594703,10.1017/dsd.2020.76,S263377622000076X,,PRODUCT CIRCULARITY INDICATORS: WHAT CONTRIBUTIONS in DESIGNING for A CIRCULAR ECONOMY?,cp,Conference Paper,Saidani M.,60106088;60000745,CentraleSupélec;University of Illinois Urbana-Champaign,Gif-sur-Yvette;Urbana,France;United States,5,"Saidani, M.;Kim, H.;Cluzel, F.;Leroy, Y.;Yannou, B.",57190437409;8445320100;55099201800;55860799691;6602469780,60000745-60106088;60000745;60106088;60106088;60106088,2020-01-01,2020,Proceedings of the Design Society: DESIGN Conference,26337762,21101052805,,Conference Proceeding,1,,,2129-2138,"This paper investigates and questions the relevance of product-centric circularity indicators in a product design context. To do so, reviews of eco-design tools and critical analyses of circularity indicators at the micro level of circular economy implementation are combined with a new workshop experimenting four of these indicators with the aim to improve the circularity performance of an industrial product. On this basis, the four tool-based circularity indicators tested are mapped on the engineering design and development process, and are positioned among the pool of main eco-design tools.",case study | circular economy | circularity indicators | design for x (DfX) | design process,18,1,repositoryam,Green,,undefined,
2-s2.0-85096164211,10.1115/DETC2020-22754,,,Methodological framework for making the transition from traditional innovation teaching towards serious games,cp,Conference Paper,Ma Y.,60196608;60106017,l’Institut de Recherche Technologique (IRT) SystemX;Université Paris-Saclay,Palaiseau;Gif-sur-Yvette,France;France,4,"Ma, Yiming;Vallet, Flore;Cluzel, François;Yannou, Bernard",57215041586;54923013200;55099201800;6602469780,60106017;60106017-60196608;60106017;60106017,2020-01-01,2020,Proceedings of the ASME Design Engineering Technical Conference,,21100838747,,Conference Proceeding,3,,V003T03A021,,"Serious games (SGs) are motivational and practical pedagogical tools that have been widely used in design education. SGs seem to be an efficient way to give instructions on innovation processes (IPs), offering unique and attractive environments to support situated learning. While there has been much interest in SGs of the IPs type, there is very little research about the design framework to reduce the complexity and time consumption of their design process. This paper presents the preliminary results of our ongoing study: A design framework adapted to innovation SGs. The framework integrates eight general design frameworks/models/methodologies for SGs. Besides, it introduces a new stage ""analysis of traditional teaching experience,""which conducive to the early phases of the design. We use a case study to prove the value of this stage. First, it AIDS designers in defining the teaching objectives of innovation SGs, that is, choosing required competencies from innovation competency frameworks. More importantly, it helps identify game mechanics that may contribute to the realization of teaching objectives. This stage should support designers successfully making the transition from traditional innovation teaching towards SGs.",Game elements | Innovation games | Innovation processes | Serious games | Teaching experience,1,0,repositoryvor,Green,CSC,undefined,China Scholarship Council
2-s2.0-85092428348,10.1016/j.procir.2020.01.102,S2212827120302717,,Energy performances assessment for sustainable design recommendations: Case study of a supermarket's refrigeration system,cp,Conference Paper,Salehy Y.,60106017,Université Paris-Saclay,Gif-sur-Yvette,France,7,"Salehy, Yasmine;Hoang, Hong Minh;Cluzel, François;Leroy, Yann;Delahaye, Anthony;Fournaison, Laurence;Yannou, Bernard",57197845491;54953445800;55099201800;55860799691;55917515900;8213343800;6602469780,60106017;60106017;60106017;60106017;60106017;60106017;60106017,2020-01-01,2020,Procedia CIRP,22128271,21100243809,,Conference Proceeding,90,,,328-333,"Nowadays, refrigeration is responsible for approximately 17% of the total electricity used worldwide and around 8% of greenhouse gas emissions. Since the Kyoto Protocols, refrigerants are subject to new regulations which represents a major challenge for the refrigeration industry. Almost half of the energy used in food retail is for cold production and studies have shown that improvement can be done to reduce this part of energy consumption. In this study, the energy consumption of a supermarket refrigeration system is assessed by considering multiple parameters. The results provide recommendations for the design of a sustainable refrigerating system integrating emerging solutions.",Efficiency | Energy consumption | Refrigeration system | Supermarket | Sustainable design,4,1,repositoryvor,Green,,undefined,
2-s2.0-85092427515,10.1016/j.procir.2020.02.123,S2212827120302602,,Assessing the environmental and economic sustainability of autonomous systems: A case study in the agricultural industry,cp,Conference Paper,Saidani M.,60106017;60005113;60000745,Université Paris-Saclay;John Deere;University of Illinois Urbana-Champaign,Gif-sur-Yvette;Moline;Urbana,France;United States;United States,8,"Saidani, Michael;Pan, Erik;Kim, Harrison;Greenlee, Andrew;Wattonville, Jason;Yannou, Bernard;Leroy, Yann;Cluzel, François",57190437409;57219371356;8445320100;57220021440;26423432900;6602469780;55860799691;55099201800,60000745;60000745;60000745;60005113;60005113;60106017;60106017;60106017,2020-01-01,2020,Procedia CIRP,22128271,21100243809,,Conference Proceeding,90,,,209-214,"While autonomous machines are considered as a new opportunity to augment safety, reliability, productivity, and efficiency, the actual environmental and economic sustainability performances of many autonomous systems remain yet to be quantified. The present research aims to fill part of this gap by evaluating the life cycle impact and cost of autonomous solutions in the agricultural industry. Comparative life cycle assessment (LCA) and life cycle costing (LCC) are carried out on a real-world case study putting in parallel a robotic electric lawn mower (autonomous solution) and conventional - gasoline- and electricity-powered - pushing mowers (human-operated counterparts). Results are interpreted in terms of global warming potential and total cost of ownership. While the autonomous system already appears to be a promising sustainable alternative, discussions and quantitative insights are also provided on the conditions that would lead to further environmental savings and economic profit for this autonomous solution.",Autonomous systems | Case study | Comparative life cycle assessment | Environmental sustainability performance | Sustainable automation,9,1,repositoryam,Green,,undefined,
2-s2.0-85084646696,10.1016/j.trpro.2020.03.066,S2352146520302453,,Shared Autonomous Vehicle Services and User Taste Variations: Survey and Model Applications,cp,Conference Paper,Maghraoui O.A.,60106017;114713254,Université Paris-Saclay;Institut de Recherche Technologique SystemX,Gif-sur-Yvette;Palaiseau,France;France,7,"Maghraoui, Ouaïl Al;Vosooghi, Reza;Mourad, Abood;Kamel, Joseph;Puchinger, Jakob;Vallet, Flore;Yannou, Bernard",57216782861;57201849973;57206248381;57188952808;56027744800;54923013200;6602469780,114713254-60106017;114713254-60106017;114713254-60106017;114713254;114713254-60106017;114713254-60106017;60106017,2020-01-01,2020,Transportation Research Procedia,23521457,21100448300,23521465,Conference Proceeding,47,,,3-10,"This study provides insight into traveler-related attributes affecting the choice of future autonomous vehicles (AVs) and explores the importance of integrating those attributes into agent-based simulations and service optimization assessments. For this purpose, an online survey was carried out to collect data on travelers of the greater Paris region along with their behavior regarding autonomous vehicles. In addition, this paper identifies AV taste variations among individuals as well as the subjective criteria behind their willingness-to-use a shared autonomous vehicle (SAV) service depending on their current mode of transport. The paper shows how traveler-related attributes are relevant to studying a shared autonomous mobility system and how they can enhance the accuracy of agent-based models and the traveler preference dimension in optimization models.",Multi-Agent Simulation | Shared Autonomous Vehicle | taste Variations,9,1,repositoryam,Green,,undefined,
2-s2.0-85069178600,10.1007/s10163-019-00897-3,,,Management of the end-of-life of light and heavy vehicles in the U.S.: comparison with the European union in a circular economy perspective,ar,Article,Saidani M.,60106017;60014439,"Université Paris-Saclay;University of California, Davis",Gif-sur-Yvette;Davis,France;United States,5,"Saidani, Michael;Kendall, Alissa;Yannou, Bernard;Leroy, Yann;Cluzel, François",57190437409;8323560800;6602469780;55860799691;55099201800,60106017;60014439;60106017;60106017;60106017,2019-11-01,1 November 2019,Journal of Material Cycles and Waste Management,14384957,145397,16118227,Journal,21,6,,1449-1461,"In a context of transition towards a more circular economy (CE), this study undertakes an analysis of the appropriate transfers and applications of best managerial practices, regulations, and know-how from the automotive sector to the heavy vehicle one, as well as from the European Union (EU) to the United States of America (U.S.), and vice versa. While the EU appears to be a few steps ahead of policy activity regarding the management of end-of-life automotive vehicles (Directive 2000/53/EC and Extended Producer Responsibility principles), the U.S. heavy vehicle industry presents several aspirational industrial practices, including the collaboration between end-of-life actors, supporting parts remanufacturing and facilitating reuse. New empirical findings and lessons learned from both geographical regions are combined with the previous analyses to develop a benchmarking template of commendable CE practices. Against this background, the findings open on the remaining challenges and circular economy opportunities for both regions, as well as for emerging and newly industrialized countries, whose automotive markets are growing fast.",Best practices | Circular economy | End-of-life management | End-of-life vehicles | Extended producer responsibility | Policy making | Recycling,27,0,repositoryam,Green,IIE,undefined,Institute of International Education
2-s2.0-85065447085,10.1016/j.eswa.2019.04.069,S0957417419303057,,Mining customer product reviews for product development: A summarization process,ar,Article,Hou T.,60106017;60027835,Université Paris-Saclay;Centrale Nantes,Gif-sur-Yvette;Nantes,France;France,4,"Hou, Tianjun;Yannou, Bernard;Leroy, Yann;Poirson, Emilie",57208646668;6602469780;55860799691;8935411600,60106017;60106017;60106017;60027835,2019-10-15,15 October 2019,Expert Systems with Applications,09574174,24201,,Journal,132,,,141-150,"This research set out to identify and structure the words and expressions related to customers’ likes and dislikes found in online reviews on order to guide product development. Previous methods have mainly focused on product features, yet reviewers express preferences on much more. Here we build on an extensive review of the design science literature to propose a summarization model containing multiple aspects of user preference, such as product affordances, emotions, and usage conditions. We also uncover the linguistic patterns describing these aspects of preference, and draft them into annotation guidelines. A case study demonstrates that our proposed model and annotation guidelines enable human annotators to structure the online reviews with high inter-agreement. As high inter-rater-agreement human annotation results are an essential step towards automating the online review summarization process with natural language processing, this study brings material for future automatization research.",Decision support | Knowledge acquisition | Online reviews | Product design | User requirement,40,1,repositoryam,Green,CSC,undefined,China Scholarship Council
2-s2.0-85063689055,10.1111/jiec.12852,,,Closing the loop on platinum from catalytic converters: Contributions from material flow analysis and circularity indicators,ar,Article,Saidani M.,60106066;60014439,"Laboratoire Génie Industriel;University of California, Davis",Chatenay-Malabry;Davis,France;United States,5,"Saidani, Michael;Kendall, Alissa;Yannou, Bernard;Leroy, Yann;Cluzel, François",57190437409;8323560800;6602469780;55860799691;55099201800,60106066;60014439;60106066;60106066;60106066,2019-10-01,1 October 2019,Journal of Industrial Ecology,10881980,23411,15309290,Journal,23,5,,1143-1158,"In this study, material flow analysis (MFA) is applied to quantify and reduce the obstacles for advancing a circular economy (CE) of platinum (Pt) from catalytic converters (CC) in Europe. First, the value chain and related stakeholders are mapped out in an MFA-like model to both facilitate the assessment of stocks and flows, and get a comprehensive view of potential action levers and resources to close-the-loop. Then, through the cross analysis of numerous data sources, two MFA are completed: (i) one general MFA, and (ii) one sector-specific MFA, drawing a distinction between the fate of Pt from (a) light-duty vehicles, under the European Union's End of Life Vehicle Directive 2000/EC/53, and (b) heavy-duty and off-road vehicles. Key findings reveal a leakage of around 15 tons of Pt outside the European market in 2017. Although approximately one quarter of the losses are due to in-use dissipation, 65% are attributed to insufficient collection and unregulated exports. Comparing the environmental impact between primary and secondary production, it has been estimated that halving the leakage of Pt during usage and collection could prevent the energetic consumption of 1.3 × 103 TJ and the greenhouse gases emission of 2.5 × 102 kt CO2 eq. Through the lens of circularity indicators, activating appropriate action levers to enhance the CE performance of Pt in Europe is of utmost importance in order to secure future production of new generations of CC and fuel cells. Moreover, the growing stockpile of Pt from CC in use indicates the need for better collection mechanisms. Also, the CC attrition during use and associated Pt emissions in the environment appears non-negligible. Based on the scarce and dated publications in this regard, we encourage further research for a sound understanding of this phenomenon that can negatively impact human health.",catalytic converter | circular economy | circularity indicators | material flow analysis (MFA) | platinum | value chain,31,0,repositoryam,Green,,undefined,
2-s2.0-85070091802,10.1016/j.destud.2019.07.001,S0142694X19300444,,Stimulating usage problem generation: An urban mobility case study,ar,Article,Al Maghraoui O.,60106017,Université Paris-Saclay,Gif-sur-Yvette,France,4,"Al Maghraoui, Ouail;Vallet, Flore;Puchinger, Jakob;Yannou, Bernard",57195771878;54923013200;56027744800;6602469780,60106017;60106017;60106017;60106017,2019-09-01,September 2019,Design Studies,0142694X,36450,,Journal,64,,,27-63,"Designers improve urban mobility solutions by investigating archetypal usage problems in existing mobility systems. User-cantered design methods help accomplish this task, but lack effectiveness when not supported by appropriate tools. Here we posit that the use of a traveller-centred stimulus improves the effectiveness of travel problem generation. To test this hypothesis, an experiment is conducted with two control groups as a baseline for non-stimulated problem generation and two experimental groups that are provided with a traveller-centred stimulus. The two sets of groups are composed of one group of urban mobility experts and one group of non-experts. Results show that stimulated groups generate novel ideas with a greater variety covering most of the traveller experience dimensions than non-stimulated groups.",case study | design problems | stimulus | user participation | user-centred design,1,1,repositoryam,Green,,undefined,
2-s2.0-85065788084,10.1115/1.4042793,,,Mining Changes in User Expectation over Time from Online Reviews,re,Review,Hou T.,60110511;60106017,Laboratoire des Sciences du Numérique de Nantes;Université Paris-Saclay,Nantes;Gif-sur-Yvette,France;France,4,"Hou, Tianjun;Yannou, Bernard;Leroy, Yann;Poirson, Emilie",57208646668;6602469780;55860799691;8935411600,60106017;60106017;60106017;60110511,2019-09-01,1 September 2019,Journal of Mechanical Design,10500472,20979,,Journal,141,9,091102,,"Customers post online reviews at any time. With the timestamp of online reviews, they can be regarded as a flow of information. With this characteristic, designers can capture the changes in customer feedback to help set up product improvement strategies. Here, we propose an approach for capturing changes in user expectation on product affordances based on the online reviews for two generations of products. First, the approach uses a rule-based natural language processing method to automatically identify and structure product affordances from review text. Then, inspired by the Kano model which classifies preferences of product attributes in five categories, conjoint analysis is used to quantitatively categorize the structured affordances. Finally, changes in user expectation can be found by applying the conjoint analysis on the online reviews posted for two successive generations of products. A case study based on the online reviews of Kindle e-readers downloaded from amazon.com shows that designers can use our proposed approach to evaluate their product improvement strategies for previous products and develop new product improvement strategies for future products.",,24,0,repositoryam,Green,,undefined,
2-s2.0-85066622871,10.1080/09544828.2019.1623383,,,Information visualisation for efficient knowledge discovery and informed decision in design by shopping,ar,Article,Abi Akle A.,60106017;60102125,Université Paris-Saclay;Université de Bordeaux,Gif-sur-Yvette;Bordeaux,France;France,3,"Abi Akle, Audrey;Yannou, Bernard;Minel, Stéphanie",57190392417;6602469780;6504200456,60102125;60106017;60102125,2019-06-03,3 June 2019,Journal of Engineering Design,09544828,12479,14661837,Journal,30,6,,227-253,"Design space exploration (DSE) describes the systematic activity of discovery and evaluation of the elements in a design space in order to identify optimal solutions by reducing the design space to an area of performance. Designers sample thousands of design points iteratively, explore the design space, gain knowledge about the problem and make design decision. The literature tells us that DSE results in a decision of quality called informed decision, which is supported by information visualisation. The representation of design points is seen as primordial to gain an understanding of the problem and make an informed decision. In our work, we have sought to identify what type of graph is best suited to the discovery phase, and enables designers to make an informed decision. We designed a web platform with four design problems, and carried out an experiment with 42 participants. We found a graph that was better suited to making a decision of quality and to gaining greater understanding: the scatter plot matrix.",computer aided design | decision making | design space exploration | Visualisation,7,0,repositoryam,Green,,undefined,
2-s2.0-85054583331,10.1016/j.jclepro.2018.10.014,S0959652618330221,,A taxonomy of circular economy indicators,re,Review,Saidani M.,60106017;60014439,"Université Paris-Saclay;University of California, Davis",Gif-sur-Yvette;Davis,France;United States,5,"Saidani, Michael;Yannou, Bernard;Leroy, Yann;Cluzel, François;Kendall, Alissa",57190437409;6602469780;55860799691;55099201800;8323560800,60106017;60106017;60106017;60106017;60014439,2019-01-10,10 January 2019,Journal of Cleaner Production,09596526,19167,,Journal,207,,,542-559,"Implementing circular economy (CE) principles is increasingly recommended as a convenient solution to meet the goals of sustainable development. New tools are required to support practitioners, decision-makers and policy-makers towards more CE practices, as well as to monitor the effects of CE adoption. Worldwide, academics, industrialists and politicians all agree on the need to use CE-related measuring instruments to manage this transition at different systemic levels. In this context, a wide range of circularity indicators (C-indicators) has been developed in recent years. Yet, as there is not one single definition of the CE concept, it is of the utmost importance to know what the available indicators measure in order to use them properly. Indeed, through a systematic literature review – considering both academic and grey literature – 55 sets of C-indicators, developed by scholars, consulting companies and governmental agencies, have been identified, encompassing different purposes, scopes, and potential usages. Inspired by existing taxonomies of eco-design tools and sustainability indicators, and in line with the CE characteristics, a classification of indicators aiming to assess, improve, monitor and communicate on the CE performance is proposed and discussed. In the developed taxonomy including 10 categories, C-indicators are differentiated regarding criteria such as the levels of CE implementation (e.g. micro, meso, macro), the CE loops (maintain, reuse, remanufacture, recycle), the performance (intrinsic, impacts), the perspective of circularity (actual, potential) they are taking into account, or their degree of transversality (generic, sector-specific). In addition, the database inventorying the 55 sets of C-indicators is linked to an Excel-based query tool to facilitate the selection of appropriate indicators according to the specific user's needs and requirements. This study enriches the literature by giving a first need-driven taxonomy of C-indicators, which is experienced on several use cases. It provides a synthesis and clarification to the emerging and must-needed research theme of C-indicators, and sheds some light on remaining key challenges like their effective uptake by industry. Eventually, limitations, improvement areas, as well as implications of the proposed taxonomy are intently addressed to guide future research on C-indicators and CE implementation.",Circular economy | Circularity indicators | Selection tool | Taxonomy,502,0,repositoryam,Green,,CBT,Ellison Medical Foundation
